,Job Position,Question,Answer,Answer Rating,Interview Phases,Skill Assessed
328,Customer Service Representative,How would you describe the pace at which you work?,"Methodical Approach: I believe in approaching tasks in a systematic and organized manner. This involves setting clear priorities, breaking down complex projects into manageable steps, and ensuring that each aspect is addressed with attention to detail.

Efficiency: While maintaining a methodical approach, I prioritize efficiency. I work diligently to meet deadlines and deliver results without sacrificing the quality of my work. This involves effective time management and prioritization of tasks based on urgency and importance.

Adaptability to Deadlines: I am adaptable to different project timelines. In a fast-paced environment with tight deadlines, I can streamline my workflow to meet the urgency of the situation without compromising the quality of my work.

Consistency: I maintain a consistent pace throughout projects, ensuring a steady progression toward goals. This approach helps in sustaining productivity over the long term and delivering reliable results.

Collaborative Speed: In team settings, I align my pace with the collaborative needs of the group. I am mindful of the team's dynamics and adjust my working speed to maintain synchronization with colleagues, fostering a cohesive and effective work environment.",Good,General,Personal Attributes
329,Customer Service Representative,What qualities do you have that make you well suited for a position in customer service?,"My primary strength lies in being a people person, thriving on personal interaction. The customer service role aligns perfectly with my inclination for connecting with individuals. Additionally, my empathetic nature allows me to tune into people's emotions and adapt my approach accordingly. Beyond interpersonal skills, I excel in thinking on my feet and leveraging creativity for effective problem-solving. These skills have been honed throughout my career and serve as valuable assets in addressing new challenges that arise in the realm of customer service.",Good,General,Personal Attributes
330,Customer Service Representative,How do you keep yourself motivated when customers take their frustrations out on you?,"Navigating heightened customer frustration is undoubtedly a challenging aspect of the role, and I find my motivation by reframing it as not a personal attack but an opportunity to empathize with the customer's perspective. Putting myself in their position fuels my drive to provide the service I would expect in similar circumstances. During tough days, a brief break in a quiet spot serves as a reset, allowing me to reconnect with the enjoyment derived from delivering exemplary customer service. I recognize that challenges are inherent in every job, but for me, they magnify the ultimate rewards, especially the satisfaction of ensuring customer contentment.",Good,General,Personal Attributes
331,Customer Service Representative,What Do You Like Most About Customer Service?,"I think I would have to say that I like the variety in the role. Each day when I go to work, I never know exactly what will happen. I might have customers who I see regularly and some of the processes may be similar, but it is impossible to predict what will happen. That variety is what keeps working in customer service exciting and interesting for me. The challenges that I might face can be difficult at times, but they are never boring.",Good,General,Personal Attributes
332,Customer Service Representative,"How Do You Manage Your Own Emotions When Dealing With a Difficult, Upset or Angry Customer?","It can be difficult at times to not get upset when a customer is particularly emotional, especially if they are being angry or argumentative. I usually try to remind myself that it probably isn’t me that they are angry with, they are angry with the situation that they have found themselves in. If I get angry or emotional myself then it will probably just make things worse. I try to remain calm and help them as much as I possibly can. Then, once the situation is over, I might take five minutes in the break area to take a deep breath before talking to the next customer, although this isn't always necessary.",Good,General,Personal Attributes
333,Customer Service Representative,What Are Your Strengths and Weaknesses When Talking to Customers?,"I would probably say that one of my biggest strengths is that I am helpful. I like helping people and I will always try to find a solution to a problem if I can. However, this is a bit of a double-edged sword and can also be a bit of a weakness. Sometimes I can end up giving more advice or information than the customer really wants or needs, so I have to be very aware of what I am saying and try to keep things short but factual.",Good,General,Personal Attributes
334,Customer Service Representative,"Have You Ever Made a Mistake at Work, and How Did You Handle It?","In my very first customer service job at a call center, I told a customer incorrect information regarding a product. I had gotten mixed up with a similar product and made the mistake of telling the customer that it had some features which were only found on the similar, but more expensive, option. Luckily I realized this before the customer bought the product and I was able to correct the information that I had given them. They chose to buy the product I had recommended initially, even though it didn’t have all of the features I had said. I did learn my lesson though and since that day I have always made sure to double-check the products I am talking about before recommending them.",Good,Situational,Personal Attributes
335,Customer Service Representative,What strategies do you use to remain calm and professional during stressful situations?,"I recently had a customer who was very agitated and demanding. I knew I needed to keep my composure, so I took a few deep breaths and reminded myself that the customer was likely just frustrated and not actually angry at me. I then proceeded to ask them questions about their experience and listened carefully to their response. After taking the time to understand the customer’s perspective, I was able to offer a solution that satisfied them and left them feeling heard and respected. I think it’s important to show empathy and take the time to understand the customer’s needs, even in the most stressful of situations. That way, I’m able to remain calm and professional while still providing excellent customer service.”",Good,General,Personal Attributes
336,Customer Service Representative,How do you keep cool in a stressful situation?,"Being prepared helps me stay calm in stressful situations. When I worked in a call center, I got a phone call from an angry customer. It was difficult for me to understand his issue because his sentences were mashed together in anger. I started piecing together what the problem was and why he was upset. I said that I understand his problem and emphasized his frustrations. He calmed down and told me fully about his situation. I knew our products and services thoroughly and managed to fix his issue in under 5 minutes. The whole interaction lasted 20 minutes, but I stayed diplomatic and acknowledged the customer. When I showed him that I value what he’s saying, it de-escalated the heat and got the client on my side so that we can solve the issue together. ",Good,General,Personal Attributes
337,Customer Service Representative,Why do you think you would be a good fit for this position? ,"On your website, you say that you value teamwork and personal development. I entirely agree that teamwork is essential in customer service and that the more your employees grow, the better service they can provide. I am a good fit for this position because I enjoy working with people and truly care about them. At my previous job, I was praised by customers because of my friendly approach and attentiveness. I value hard work and supporting each other in a team. I also want to keep developing and growing professionally, and I think your company will be a great place for this. My experience provided me with many opportunities to challenge myself and develop. I can bring all the lessons I learned throughout the years and positively impact the team.",Good,General,Personal Attributes
338,Customer Service Representative,What skills do you have that will be useful in this job?,"I love helping customers and always look forward to the opportunity to make our customers feel special and valued. My excellent communication skills and attentiveness, alongside my positive attitude, bring a good atmosphere into the workplace. Just last week, I was helping a client with their system issue. I listened closely to what his problem was and tried every solution one by one with him. When we managed to find and fix the issue, he was very grateful and said he struggled with it the whole previous day. We got a returning customer and a five-star review from him that afternoon.",Good,General,Personal Attributes
339,Customer Service Representative,What attracted you to apply for this position?,"I’ve been working in customer service for over six years now. I want to continue my journey by developing my skills further. After reading the job description and looking at your company’s values, I found that you value your employees’ personal growth, which drew my attention. You also mention that you treat failures as lessons, not a breaking point. I think this is a great opportunity to continue my development and growth. I would like to get up to speed quickly and start contributing results for your business in this role.",Good,General,Personal Attributes
340,Customer Service Representative,Why should we hire you?,"I can learn quickly to start delivering great results, and I think I would fit in your company. I’m passionate about my work and have achievements in helping companies succeed by providing exceptional service for our customers. When I joined the previous company as a customer service representative, I focused on providing excellent support to clients. I brought my experience and positive nature to the position and did my best for our clients. After learning how the company operates, I started motivating my team members to do their best for our customers as well. The company’s churn rate decreased by 14% in just eight months, and I was mentioned in over a dozen five-star reviews.",Good,General,Personal Attributes
341,Customer Service Representative,Describe a time when you made a mistake at work and how you handled it.,"When I moved to a different company to become a customer service manager, I started changing the team structure and how everything was working. I had experience with this system and knew it was effective, so I wanted to implement it in my new place of work. The opposite of what I hoped happened. The team became less organized and more disconnected. They didn’t know the system and were not comfortable with it. I realized I was pushing something on them that didn’t fit. I realized my mistake and called a team meeting to brainstorm and discuss changes they thought would benefit the work environment. I noted their suggestions, removed my system, and implemented some of the changes we agreed on as a team. Ever since that day, my team feels closer to each other, and our office is a pleasant place to be.",Good,Situational,Personal Attributes
342,Customer Service Representative, How Do You Keep Yourself Motivated When People Are Being Mean to You?,"If I know someone’s anger isn’t really directed at me, I tend to not get very emotionally affected by them taking their frustrations out on me. I understand that to them, I represent a company that has done something they see as wrong. It’s my job to try to help them and try to improve their idea of the company. So I make sure they feel heard, usually by allowing them to vent for a minute before getting into the service part of customer service. However, on days when it feels like I’m only getting angry customers, sometimes I like to unwind by blasting my favorite music on the drive home.”",Good,General,Personal Attributes
343,Customer Service Representative, Have you ever made a mistake while handling a customer service problem? How would you manage it now?,"At my first Internship as a customer service representative, I was supposed to forward a customer's call to the tech department and confused the number with the financial department because they were similar. We did waste some valuable customer service time, but I learned from my mistake, and I got the company's phone sheet to be more accurate.”",Average,General,Personal Attributes
344,Customer Service Representative,How do you balance local volume with internal responsibilities like follow-ups or administrative work?,"in my previous job, I found that team collaboration and the use of customer service tools will help in managing my workload.”",Average,General,Personal Attributes
345,Customer Service Representative,How do you deal with stress?,"I know that sometimes it is hard to avoid stress, but I try to face the situation, rather than being stressed. Regardless of how much work I have to do, I make sure that I tackle the situation rather than being overwhelmed by the problem. That way, I handle the situation better and don’t get stressed. For example, when I dealt with an unsatisfied customer that was really angry and was ready to give a negative review about our product. Instead of feeling stressed, I concentrated on finding out what her challenge was exactly and looked for ways to help her get the problem solved addressing it to the right channel. My ability to remain calm when dealing with the unsatisfied customer reduced my stress and the stress that the customer may face”. For me, communication is key to a stressful situation. Many times I communicate as much as possible to make sure that I am on the same page with everyone involved in what I am working on. It reduces errors and cuts down stress to a very large extent. In my previous job, I was working on a project with another team and found out that after a while we had a different approach on the same project. I called for a stand-up meeting so that we can come to a logical conclusion and carry on with the project. At the end of the day, we agreed on one vision and the project went on successfully”.",Good,General,Personal Attributes
346,Customer Service Representative,How do you plan to ensure you complete a number of tasks effectively?,"No matter the number of tasks I have to complete, I always calm down first and figure the best way to go about completing the task. Whenever I have multiple tasks to complete, I start by organizing the tasks from the most important to the least important task, then I would start working on the most important task. If I am experiencing any challenge working on any of the tasks, I don’t hesitate to ask a professional for assistance”. Whenever I have multiple tasks to complete, I, first, of all, maintain a positive mindset on the whole task and avoid getting frustrated. I then come up with a plan to carry out the task and meet up with the set deadline. And if I cannot meet up with the set deadline I would politely ask for an extension”.",Average,General,Personal Attributes
347,Customer Service Representative,How do you build relationships with other members of your team?,"I understand that building a good relationship with team members will increase productivity. When I am new to a team, I try to first understand the personalities of team members. Understanding their personality type will help you better deal with them. I also get interested in what they do and show concern about their interest and goals, then we can communicate on a more shared ground”. I build an interpersonal relationship with my team members by building interest around what they do. In my current job, I always take a look at what someone has done and give a form of review or an opinion about how it can be better, or simply encourage good work. I was known to be the eagle’s eye of my team”.",Good,General,Personal Attributes
348,Customer Service Representative,How Do You Keep Yourself Motivated When People Are Being Mean to You?,"If I know someone’s anger isn’t really directed at me, I tend to not get very emotionally affected by them taking their frustrations out on me. I understand that to them, I represent a company that has done something they see as wrong. It’s my job to try to help them and try to improve their idea of the company. So I make sure they feel heard, usually by allowing them to vent for a minute before getting into the service part of customer service. However, on days when it feels like I’m only getting angry customers, sometimes I like to unwind by blasting my favorite music on the drive home.”",Good,General,Personal Attributes
349,Customer Service Representative,what are your weaknesses,i believe i happen to go out of the way to help people sometimes this has cost me a lot for example i once lent a considerable amount of money to one of my acquaintances to bail him out of a financial crisis without verifying all the details about him later the person failed to repay my loan however i learned my lesson and thereon i am extremely cautious about such decisions,Good,General,Personal Attributes
350,customer service representative,how would past co-workers or classmates describe you,my colleagues used to call me smiley in my last job because i used to maintain a smile at all times regardless of the situation the smile helps me to maintain a positive attitude and ease the tensions of customers,Good,General,Personal Attributes
351,customer service representative,what do you consider to be your greatest customer service strength,my greatest customer service strength is my ability to empathize with customers and understand their needs this helps me provide personalized solutions and ensure their satisfaction i am also skilled in active listening and problem-solving which allows me to handle any issue that may arise effectively,Good,General,Personal Attributes
352,Customer Service Representative,How do you prioritize customer requests and inquiries?,"I prioritize requests based on their urgency and importance. If necessary, I will escalate urgent issues to a supervisor or manager. I also strive to respond to all customer inquiries in a timely manner.",Good,Role Specific,Prioritization
353,Customer Service Representative,how do you prioritize your work,i review my task list in asana each morning and address customer communication right after adding new tasks based on urgency and moving critical tasks to the top of the list i communicate with the customer immediately even if i do not have a resolution so they know were working on the issue,Good,Role Specific,Prioritization
354,customer service representative,how do you prioritize customer inquiries when handling a large volume of inquiries,when handling a large volume of inquiries i prioritize them based on their urgency and importance i start with the inquiries that require immediate attention such as those related to safety or security issues then i move on to inquiries that have a high impact on customer satisfaction such as those related to product or service quality finally i address inquiries that can be handled in a timely manner such as general questions or feedback throughout the process i ensure that all customers are treated with respect and receive a timely response,Good,Role Specific,Prioritization
355,Customer Service Representative,How Do You Determine Your Priority?,"First, I would list all my work a day before and see what I need to deliver on priority. Once that is determined, I would take easy and simple steps to complete the work and deliver it by the end of the day. If any of my team members face any difficulties during call handling, I would help them with it since being a manager it’s my priority too to help my team, and  provide them with the solution.”",Good,Role Specific,Prioritization
356,Customer Service Representative,"How do you prioritize competing demands on your time, such as customer requests and administrative tasks?",I prioritize competing demands on my time by assessing the urgency and importance of each task and communicating with colleagues and supervisors to ensure that customer needs are met while also meeting administrative requirements.,Good,Role Specific,Prioritization
357,Customer Service Representative,Describe a time when you faced a challenging deadline. How did you prioritize tasks and ensure timely completion?,"As a project manager, I faced a challenging deadline where I needed to deliver a complex design project before we closed for December. I broke down the project into smaller milestones, created a detailed timeline, and delegated responsibilities to team members. By closely monitoring progress, addressing roadblocks, and fostering collaboration, we successfully met the deadline.",Good,Situational,Prioritization
358,Customer Service Representative,How do you prioritize tasks when faced with multiple requests from customers?,"When faced with multiple requests from customers, I prioritize tasks in a way that ensures I’m providing the best customer service. I start by assessing the urgency of each request and then prioritize them accordingly. I also use a variety of techniques and strategies to stay organized and on task while handling multiple customer inquiries. I always strive to meet customer needs in a timely manner, and I’m committed to providing excellent customer service.”",Good,Role Specific,Prioritization
359,Customer Service Representative,how do you handle getting negative feedback from a customer,any feedback from customers is valuable feedback it helps me understand what i can improve about my level of customer service or how the business can improve the product or processes listening to the customer and implementing their feedback gives the customer a voice and makes them feel valued which is a positive for the business,Good,Role Specific,Problem-solving skills
360,Customer Service Representative,how do you handle an angry customer,i think it is always important to remember that in the customers world their issue is the most important issue it makes sense that they are angry and have a sense of urgency i have found that in these situations i am more successful when i frame my response as helping the customer find the best possible answer,Good,Role Specific,Problem-solving skills
361,Customer Service Representative,can you give me an example of a time when you turned an angry customer into a happy one,i once had an angry customer who was venting about a product that arrived broken he said the product was a gift for his daughter whose birthday was the next day he would have to show up to her party empty-handed i told him i was so sorry for what happened but i thought of how we could help,Average,Role Specific,Problem-solving skills
362,Customer Service Representative,describe a time when you could not solve a customers problem,one time the customer wanted support on an outdated product that we no longer carried after advising of this the customer insisted that there must be something we could do since it was our product after asking the customer if it was okay to find an answer and return their call by the end of the day i escalated the issue to my supervisor,Good,Situational,Problem-solving skills
363,Customer Service Representative,what was the biggest mistake you've made on the job and how did you handle it,i pride myself on my close attention to detail and error-free work however i made a careless mistake while entering an order for baking soda typing in 50 pounds instead of 5000 pounds that the customer needed to make lavender bath bombs for the holiday season the order was delivered they were well short of what they needed and their production lines were shut down,Average,Role Specific,Problem-solving skills
364,Customer Service Representative,describe your approach and the result of a situation when you needed to make a judgment call,a customer once requested a refund for a pair of shoes because they werent satisfied with them we had a policy that we could not process returns on used items after reviewing the customers file and interaction history in our crm i asked them a series of questions about the quality of the product and why they werent satisfied,Average,Role Specific,Problem-solving skills
365,customer service representative,have you ever found it challenging to interact with a customer because you did not understand their request,although i always try to solve customers queries myself on one occasion i had to seek advice from a colleague,Average,Role Specific,Problem-solving skills
366,customer service representative,have you ever refused to offer a service to a client due to a company policy,an important client wanted to use a promotion code that had expired half a year ago unfortunately i had to decline the request however i approached the situation with empathy and explained that i fully understood the clients frustrationi then gave them information on our upcoming promotions they could use on their next purchases,Good,Role Specific,Problem-solving skills
