,Job Position,Question,Answer,Answer Rating,Interview Phases,Skill Assessed
252,Customer Service Representative,Why should we hire you?,"I offer a robust background with [X years] of industry experience, reflecting a proven track record of achievements and responsibilities relevant to this role.

Adaptability is one of my key strengths, enabling me to navigate new challenges with resilience and contribute effectively in dynamic environments.

Strong communication skills, both verbal and written, distinguish me as an effective collaborator with team members and clients alike.

I am a proactive problem solver, with a demonstrated ability to analyze complex situations and implement effective solutions.

My team-oriented approach, continuous learning mindset, and results-driven orientation position me as a valuable candidate for contributing to the success of your organization.",Good,Introduction,Introduction
253,Customer Service Representative,Tell me about something that's not on your resume.,"Outside of my professional background, I've been actively involved in volunteering with a local non-profit organization. This experience has allowed me to contribute to community outreach programs and develop valuable leadership and organizational skills.

Beyond my formal work experience, I have dedicated time to mentoring initiatives in collaboration with local community organizations. This involvement has provided me with the opportunity to contribute to the personal and academic development of individuals outside of a traditional work setting.

One noteworthy aspect not captured on my resume is my active participation in a charity run where I raised funds for a cause I am passionate about. This event showcased my commitment to social responsibility and community engagement.

I have a personal blog where I share insights on [specific topic or interest]. While not directly related to my professional background, it reflects my passion for continuous learning and knowledge sharing in a more informal setting.

Outside of my work, I am an avid [specific hobby] enthusiast. This interest not only serves as a creative outlet but also contributes to my ability to maintain a healthy work-life balance and brings a unique perspective to my professional endeavors.",Good,Introduction,Introduction
254,Customer Service Manager,"As a Team Leader, How Well Do You Handle Rejection?","I take failure as a lesson to do better in the future. I learn and try to fix my mistakes. In my previous job, I faced a similar situation, and I went to my colleagues and team members to take feedback from them. Though I am a team leader, in my opinion there are still so many things I need to learn.”",Average,Role Specific,Leadership Skills
255,Customer Service Manager,How Do You Measure Success As a Manager?,"In my last job, I measured success by not only analyzing customer feedback but also the measures my team members took to resolve particular problems. I also reviewed the call and chat records to see how well my team members handled the query. Additionally, I also measure my success by tracking how many calls I handle in a day and how many cases I close in a day.”",Good,Role Specific,Leadership Skills
256,Customer Service Manager,What According to You are the Skills That a Good Manager Must Possess?,"A manager must possess the following skills: Technical skills to make informed decisions and solve problems efficiently. Conceptual skills to think outside the box. As customer service is beyond the script, managers must possess creative ideas, vision, and strategies. Interpersonal skills, which make them great leaders. This includes building relationships, managing teamwork, and providing feedback.”",Good,Role Specific,Leadership Skills
257,Customer Service Manager,How do you ensure that your department’s goals are in line with the overall company goals?,The company I currently work for publishes an annual report of KPIs relating to the goals they hope to achieve that year. I extract the company goals that are relevant to my department and break them down into weekly objectives. I then use these objectives to ensure that my team is constantly contributing to the overall goals of the organisation.,Good,Role Specific,Leadership Skills
258,Customer Service Manager,"How would you measure the success of you and your team over a 3, 6 and 12 month period?","In line with the over-arching goals of the company, I would set personal goals for myself and my team which I would subsequently break down into weekly SMART objectives. I would monitor these closely through general in-office communication and a series of team meetings, as well as through scheduling individual appraisal meetings at 3, 6 and 12 month intervals.",Good,Role Specific,Leadership Skills
259,Customer Service Manager,"Share an example of a project or initiative you led that did not go as planned. What were the challenges, and how did you handle them?","I led a product launch that faced unexpected supply chain disruptions, leading to delays. I quickly identified alternative suppliers, coordinated with the production team, and communicated the revised timeline to stakeholders. By managing expectations and maintaining transparency, we minimized the impact and successfully launched the product.",Good,Situational,Leadership Skills
260,Customer Service Manager,"Describe a situation where you took the initiative to implement a new process or improve an existing one. What steps did you take, and what were the results?","Recognizing inefficiencies in our project management system, I conducted research, proposed a new software solution, and gained buy-in from key stakeholders. By leading the implementation process and providing training to team members, we streamlined our workflow, resulting in a 20% increase in project efficiency.",Good,Situational,Leadership Skills
261,Customer Service Manager,Share an experience where you had to lead a team through a challenging project or task. How did you motivate and guide your team to achieve success?,"As a project leader, I once had to revise a complex project from which a significant portion of funding had been withdrawn. I established clear goals, communicated expectations, and provided continuous support and feedback to team members. By recognizing their contributions, fostering a positive team culture, and addressing challenges proactively, we successfully innovated to complete the project within the new budget and received accolades from stakeholders.",Good,Situational,Leadership Skills
262,Customer Service Manager,"Tell me about a time when you had to make a difficult decision that had a significant impact on your team or organization. How did you approach the decision-making process, and what were the outcomes?","When our department faced budget cuts, I analyzed various cost-saving measures, consulted with team members, and made the difficult decision to restructure our operations. By communicating transparently, minimizing job losses, and reallocating resources strategically, we maintained productivity and achieved a 15% cost reduction.",Good,Situational,Leadership Skills
263,Customer Service Manager,Describe a situation where you had to lead a team through change or transition. How did you manage resistance and ensure a smooth transition?,"During a company-wide rebranding initiative, I established a clear vision, communicated the rationale behind the change, and actively involved team members in the decision-making process. By addressing concerns, providing support, and celebrating milestones, we successfully navigated the transition and embraced the new brand identity.",Good,Situational,Leadership Skills
264,Customer Service Manager,"Share an example of a time when you mentored or coached a team member to help them achieve their full potential. How did you approach the mentoring process, and what were the outcomes?","I identified a team member with untapped potential, provided guidance, and assigned them challenging projects to foster growth. I also offered constructive feedback, encouraged continuous learning, and supported their professional development. As a result, the team member gained new skills, took on leadership roles, and received a promotion within the organization.",Good,Situational,Leadership Skills
265,Customer Service Representative,Tell me about a time you led or worked in a team,"In my previous job as a sales executive, we were divided into teams to see how we can improve sales on the new product. My team members and I developed a plan to have each member handle a specific area so that we specialize and deliver at the right time. At the end of the day, we were able to increase sales with up 10% from what we used to have in the previous year”.",Good,Situational,Leadership Skills
266,customer service representative,how do you ensure that your customer service team is adhering to company policies and guidelines,regular training and coaching sessions are conducted to ensure that the customer service team is up to date with the companys policies and guidelines clear communication channels are established and the policies are documented and easily accessible to the team quality assurance audits are performed regularly to ensure compliance and identify areas that need improvement feedback is provided to the team members and corrective actions are taken if necessary,Good,Role Specific,Leadership Skills
267,customer service representative,how do you ensure that your customer service team is providing a consistent customer experience,to ensure a consistent customer experience we focus on providing comprehensive training to our customer service team members we also have clear and concise guidelines and procedures that outline our standards for customer service regular monitoring and feedback on customer interactions helps us identify areas for improvement and maintain consistency across all channels additionally we regularly gather feedback from customers to ensure that our team is meeting their expectations and delivering a consistent experience,Good,Role Specific,Leadership Skills
268,customer service representative,how would you measure the success of your customer service team,one way to measure the success of a customer service team is by tracking key performance indicators such as response time customer satisfaction ratings and first-contact resolution rate it is also important to regularly gather feedback from customers and use that feedback to continuously improve the teams performance,Good,Role Specific,Leadership Skills
269,customer service representative,how would you manage a customer service team across multiple locations,to manage a customer service team across multiple locations i would ensure that communication channels are established and clear expectations are set regular meetings and check-ins would be scheduled to review performance metrics address concerns and provide coaching and development opportunities consistency in training processes and policies would be maintained across all locations and technology tools such as a shared ticketing system and communication platform would be utilized to streamline operations and ensure seamless customer service delivery,Good,Role Specific,Leadership Skills
270,customer service representative,what steps do you take to ensure that your customer service team is motivated and engaged,as a customer service executive i believe in creating a positive and supportive work environment for my team i prioritize regular communication recognizing individual and team achievements and providing opportunities for professional development additionally i ensure that team members have the necessary resources and tools to perform their jobs effectively and provide constructive feedback to continuously improve our teams performance,Good,Role Specific,Leadership Skills
271,customer service representative,how do you ensure that your customer service team is providing personalized and empathetic responses to customers,one way to ensure personalized and empathetic responses is to provide ongoing training and coaching to the team we can also encourage active listening and teach them to put themselves in the customers shoes additionally we can collect feedback from customers and use it to improve our responses finally we can empower our agents to make decisions and provide solutions that are tailored to each customers specific situation,Good,Role Specific,Leadership Skills
272,customer service representative,how do you ensure that your customer service team is staying up-to-date with industry best practices,as a customer service executive i would ensure that my team is staying up-to-date with industry best practices by providing regular training sessions encouraging participation in industry events and conferences and promoting ongoing learning opportunities i would also encourage team members to share their insights and experiences with the rest of the team so that everyone can benefit from the latest developments and trends in the field finally i would make sure that my team has access to the latest tools and technologies that can help them provide the best possible customer service,Good,Role Specific,Leadership Skills
273,customer service representative,how do you ensure that your customer service team is providing a seamless omnichannel experience for customers,to ensure a seamless omnichannel experience we provide consistent training to our team members on all channels and maintain a centralized database for customer interactions we also use integrated technology platforms that allow us to track customer journeys across all touchpoints enabling us to provide a personalized experience for each customer regardless of the channel they choose to use additionally we regularly monitor customer feedback and data to identify pain points and opportunities for improvement in the omnichannel experience,Good,Role Specific,Leadership Skills
274,Customer Service Representative,If You are Hired What Do You Think Would Be Difficult for You?,"When I joined the last company as a manager, there were many new faces, each with a unique personality. Communicating with new people gives me butterflies as I am not aware of their traits and characteristics. Knowing everybody takes time. But things are in place within a very short time.”",Average,Role Specific,Personal Attributes
275,Call center agent,"If our call center is involved in activities that bend many laws, would you work with us?",I will have to decline because personal ethics are indispensable to me while selecting my place to work.,Good,General,Personal Attributes
276,Customer Service Representative,Describe your work ethic.,"My work ethic is characterized by a combination of dedication, adaptability, and a results-oriented approach. Here are key aspects of my work ethic:

Dedication: I approach my work with a high level of dedication and commitment. Meeting deadlines and delivering quality results are top priorities for me. I take ownership of my responsibilities and strive to exceed expectations.

Adaptability: I am adaptable to changing circumstances and environments. In a dynamic work setting, I thrive on embracing new challenges and adjusting my approach to meet evolving requirements. This adaptability ensures that I can effectively navigate various scenarios.

Results-Oriented: I maintain a results-oriented mindset. Setting clear goals and benchmarks, I work diligently to achieve positive outcomes. Whether it's meeting project milestones or contributing to team objectives, I focus on tangible results.

Collaboration: Collaboration is a cornerstone of my work ethic. I value open communication, actively seek input from team members, and contribute constructively to team goals. I believe that collective efforts lead to more impactful outcomes.

Continuous Improvement: I am committed to continuous learning and improvement. Actively seeking opportunities for professional development, I stay informed about industry trends and emerging best practices. This commitment ensures that I bring fresh insights to my work.",Good,General,Personal Attributes
277,Customer Service Representative,how well do you work under pressure,working under pressure is just part of being a customer service rep when a situation pops up i take a deep breath and think before reacting to make sure i am following the best course of action to reach a fast and satisfactory resolution,Good,General,Personal Attributes
278,Customer Service Representative,what time management techniques do you use,i like being proactive when planning my daily and weekly tasks and adjusting them as needed i use asana to keep projects in order and google tasks to send me reminders for upcoming deadlines i block out my calendar for the first hour of each day to address any communications or tickets that came in overnight before logging off each day i review daily weekly and monthly tasks to make sure i met all deadlines and that i am on track if i start falling behind on a certain task i will communicate with management right away so everyone is in the loop,Good,General,Personal Attributes
279,Customer Service Representative,what are your strengths whats your greatest weakness,i have always had issues with public speaking it is important to feel comfortable speaking up especially in meetings i have been working with a speech coach to help me overcome my overwhelming fear i hope i have the opportunity to jump into conversations with this new role if given the opportunity,Good,General,Personal Attributes
280,Customer Service Representative,why do you think youd be a great fit,i am the best fit for this position because of my extensive experience and training in customer service combined with my passion for helping people i consistently go above and beyond to create a great customer experience and would love to grow and develop with a business like yours that aligns with my values,Good,General,Personal Attributes
281,Customer Service Representative,if you had a superpower what would it be and why,my superpower would be superhuman strength and resiliency i would like to be able to bounce back unscathed after a challenging situation with a difficult customer and continue to thrive and adapt,Good,General,Personal Attributes
282,customer service representative,what motivates you in your career,i find motivation from the people i work with and those i help my work colleagues are an extension of my family and i want to see them do well similarly i find customer service very rewarding there is no better feeling than making someones day when you resolve an issue,Good,General,Personal Attributes
283,customer service representative,what are the qualities that would make you an asset to our customer service team,i understand the role of a csr very well i have an innately positive and empathetic nature which i believe makes me approachable and people-friendly besides i have always had a passion for helping others and an instinct for quick problem-solving,Good,General,Personal Attributes
284,customer service representative,how do you usually respond to negative feedback or criticism be it from customers or teammates,i take it in my stride instead of taking it to heart i believe there is always a learning opportunity in a negative review or comment and i do my best to use it to improve on myself and my work,Good,General,Personal Attributes
285,customer service representative,would you ever put the customers needs over company policies what is your take on the ethics of rule-breaking ifwhen it comes to solving a customers problems,i understand that sometimes rules can be tweaked to offer a faster or easier solution but even though i am new on the field i have resolved never to compromise on my ethics to earn a quick buck i would rather fail a customer once than fail myself,Average,General,Personal Attributes
286,customer service representative,what do you like about being a csr,i like the fact that it is a people-facing job and deals with active communication and problem-solving dealing with issues first-hand and resolving them is not just satisfying but also helps build management skills,Average,General,Personal Attributes
287,customer service representative,what do you dislike about working in customer service,customer service comes with a fair amount of stress and frustration thanks to heavy volume of calls difficult customers long hours or repetitive work besides these i am also concerned about outsourcing and automation threatening the customer service industry right now,Average,General,Personal Attributes
288,customer service representative,describe a mistake that you made handling a customer service issue and how you mitigated it,in my previous role i came to realise that after resolving a customers query i did not close the ticket in the system before moving on to the next call this had an impact on our satisfaction surveys and also resulted in customers receiving follow-up messages that were not necessary after my supervisor reminded me to make the closing of tickets a part of my routine i was more mindful of that particular step when ending a call,Average,General,Personal Attributes
289,customer service representative,how would former colleagues describe you,in my previous role my manager praised my positive attitude and often remarked that they would never seen me without a smile on my face i know that my sunny disposition helps with customer interaction as it makes them feel comfortable in my presence,Average,General,Personal Attributes
290,customer service representative,have you ever made a mistake while handling a customer service problem how would you manage it now,at my first internship as a customer service representative i was supposed to forward a customers call to the tech department and confused the number with the financial department because they were similar we did waste some valuable customer service time but i learned from my mistake and i got the companys phone sheet to be more accurate,Average,General,Personal Attributes
291,customer service representative,how do you feel about working at night on the weekend or in the early mornings to maintain our -hour customer service policy,i am comfortable working in such a schedule we provided customer service 247 at the fintech company i used to work at i used to switch between morning shifts and night shifts,Good,General,Personal Attributes
292,customer service representative,how do you balance local volume with internal responsibilities like follow-ups or administrative work,in my previous job i found that team collaboration and the use of customer service tools will help in managing my workload,Average,General,Personal Attributes
293,customer service representative,do you have experience working remotely what skills do you need to work remotely,the fintech company in my resume let me will work from home i used to manage social media pages and email pages during this time i usually plan myself well to avoid distractions i also work with deadlines and goals to measure my productivity,Average,General,Personal Attributes
294,customer service representative,how do you keep yourself motivated when the job seems repetitive,first i usually set clear and realistic goals to help me manage my workload next i also try to engage with my team members to create a conducive and positive working environment also i do create time for my hobbies outside work to keep my mind refreshed,Average,General,Personal Attributes
295,customer service representative,how would past colleagues or classmates describe you,at my last job my peers nicknamed me smiley because i try to smile as much as possible it makes me feel more positive and helps put customers at ease,Average,General,Personal Attributes
296,customer service representative,which mode of communication do you prefer,while i enjoy using many modes of communication i find it easy to pick up certain peoples frustrations better when speaking to a person directly or via the phone in the past i have also found this mode to be effective at forming connections with customers as opposed to text-based communication or social media which can have slow responses,Good,General,Personal Attributes
297,customer service representative,how do you manage your time when handling multiple customer inquiries,when handling multiple customer inquiries i prioritize each inquiry based on its urgency and importance i strive to address each customers issue promptly and efficiently while also ensuring that i provide personalized and effective solutions i may use tools like a crm system or time management software to help me stay organized and track my progress it is also important to communicate proactively with customers letting them know the expected timeframe for resolution and providing regular updates by managing my time effectively i can ensure that each customer receives the attention and service they deserve,Good,General,Personal Attributes
298,customer service representative,how do you handle customer inquiries that come in after business hours,at our company we strive to provide the best customer service possible even outside of regular business hours to handle inquiries that come in after hours we have implemented various solutions including a 247 chatbot an email ticketing system and a dedicated phone line that routes to an on-call representative we aim to respond to these inquiries promptly and provide a clear timeframe for resolution if needed by offering these options we ensure that our customers can receive support when they need it most regardless of the time of day,Good,General,Personal Attributes
