,Job Position,Question,Answer,Answer Rating,Interview Phases,Skill Assessed
132,customer service representative,how would you design a customer service strategy to address the needs of a global customer base,to design a customer service strategy for a global customer base i would start by conducting research on cultural differences and communication preferences in different regions then i would work to establish multilingual support channels and train customer service representatives to understand and respect cultural differences it is also essential to ensure consistency in service quality across all regions and gather feedback to continually improve the customer experience,Good,Role Specific,Customer Service Skills
133,customer service representative,what is your experience with customer journey mapping,customer journey mapping is a crucial tool to understand the customer experience and improve it mapping the customer journey from start to finish helps identify pain points and opportunities for improvement it involves understanding the customers needs motivations and behaviors at each stage of their journey including pre-purchase purchase and post-purchase it enables companies to provide a seamless customer experience and increase customer satisfaction,Good,Role Specific,Customer Service Skills
134,customer service representative,can you describe a time when you used data to improve the customer experience,a company i worked with collected customer feedback through surveys social media and customer support tickets by analyzing the data we identified a pattern of complaints about the websites navigation we then collaborated with the development team to make changes to the websites layout and navigation after the changes were implemented customer complaints decreased and satisfaction increased this data-driven approach helped us improve the customer experience and meet their needs,Good,Role Specific,Customer Service Skills
135,customer service representative,can you explain the role of customer service in the overall customer experience,as a customer service executive i believe that customer service plays a critical role in shaping the overall customer experience it is often the first point of contact that customers have with a business and the quality of service they receive can significantly impact their perception of the brand providing prompt accurate and personalized service is essential to creating a positive customer experience and building long-term customer loyalty,Good,Role Specific,Customer Service Skills
136,customer service representative,can you describe a time when you used customer insights to drive product or service improvements,customer insights can be used to identify pain points and areas for improvement for example if customers consistently provide feedback about a specific feature that is difficult to use or not meeting their needs the product or service team can use this feedback to make necessary improvements this can result in a better overall customer experience and increased customer satisfaction,Good,Role Specific,Customer Service Skills
137,customer service representative,how would you design a customer loyalty program to improve customer retention,to design a customer loyalty program i would first analyze the current customer base to determine their preferences and needs based on this analysis i would identify reward options that align with their interests i would also establish program guidelines and communication channels to ensure customers are aware of the program and its benefits additionally i would track and analyze program performance to refine the program over time and maximize its impact on customer retention,Good,Role Specific,Customer Service Skills
138,Customer Service Agent,How Do You Demonstrate Your Value on the First Call?,"During my first call with the customer, I always aligned myself with their goals and expectations and understood their problem. I also ensure I have the right tools handy to help them out. I assure them I am always available  to help them, which helps build a good rapport between the customer and me at the first call itself .”",Good,Role Specific,Customer Service Skills
139,Customer Service Representative,Have You Ever Defended a Customer?,"A customer called who has recently checked into a hotel. Upon entering the room, he found the AC, kettle, balcony, etc., were missing. He was disheartened and said these amenities were listed on the website, but the hotel denied them. Upon checking, it was confirmed that the customer was right. It was an error from the hotel’s end, as they didn’t update their amenities. Hence, we offered a voucher for future use. As a result we were able to retain a customet.”",Good,Situational,Customer Service Skills
140,Customer Service Agent," When responding to a customer, how do you decide what information to include and what to leave out?","While responding to the customer, first of all, I will make sure to show some gratitude towards the customer for their effort. Then after analyzing the customer’s request, I will provide all the possible solutions that can be offered. I will not include anything that misleads the customers.",Good,Role Specific,Customer Service Skills
141,Customer Service Representative,What Does Customer Service Mean to You?,"For me, excellent customer service is about making connections through effective communication. There's no one-size-fits-all. Every customer is unique, and I find it incredibly rewarding when an issue is resolved in a way that makes them feel valued and understood. It's not always easy, but it's my responsibility to ensure every customer is heard and even the most challenging of situations are handled to the best of my ability.",Good,Role Specific,Customer Service Skills
142,Customer Service Representative,What does customer service mean to you?,"To me, customer service is going that extra step to ensure we help our customers and exceed their expectations. It is making sure that the client wants to share their experience with friends and family and recommend us to their close ones. ",Average,Role Specific,Customer Service Skills
143,Customer Service Agent,Explain the terms CSAT and NPS.,"Customer Satisfaction (CSAT) is basically a key performance indicator that is used to keep track of satisfied customers, while Net Promoter Score (NPS) means a metric for surveying customer loyalty for a company’s image, products, or any other administrations. This is being used by many companies as their CRM strategy.",Average,Role Specific,Customer Service Skills
144,Call center agent,What is the difference between Inbound and Outbound?,"In the inbound process we satisfy the customer by solving their problem related to our company, and in the outbound process, we call the customer to sell the company’s products and services.",Average,Role Specific,Customer Service Skills
145,Call center agent,Do you know the procedures which should be followed while talking to a customer?,"First Greet Customer, Then introduce yourself to him/her. Ask the customer about how an agent can be helpful, Listen to the customer calmly and Try to help the customer in every possible way. Then Cross check if the customer is satisfied with your solution or not and Make sure whether the customer needs further help.",Good,Role Specific,Customer Service Skills
146,Customer Service Agent,What are the qualities of customer service?,"Communication skills, problem solving skills and a friendly attitude",Average,Role Specific,Customer Service Skills
147,Customer Service Agent,What does excellent customer service mean to you?,Excellent customer service is something to go above and beyond to keep their customer happy and satisfied with the products or services offered by your company. It means to show some extra care towards each customer so that they feel unique and essential and ready to interact with your company again in the future.,Good,Role Specific,Customer Service Skills
148,Call center agent,Are you able to work with multiple phone lines?,"If you have any experience in handling multiple calls, then say yes. In case you don’t have any then say once training is provided, I could handle numerous calls with ease.",Average,Role Specific,Customer Service Skills
149,Customer Service Representative,What are some effective strategies for building rapport with customers?,"Effective strategies for building rapport with customers include active listening, using positive language, and personalizing the interaction to the customer’s needs. It’s important to establish trust and make the customer feel valued.",Good,Role Specific,Customer Service Skills
150,Customer Service Representative,How do you stay up-to-date with product and service information?,"I attend training sessions, read company updates, and proactively seek information from colleagues to stay informed. I also keep up-to-date with industry trends and best practices.",Average,Role Specific,Customer Service Skills
151,Customer Service Representative,What is your approach to resolving complex customer issues?,"My approach is to break down the issue into manageable parts, collaborate with colleagues or supervisors, and communicate clearly and effectively with the customer. I strive to find a solution that meets the customer’s needs while also adhering to company policies.",Good,Role Specific,Customer Service Skills
152,Customer Service Representative,What is your experience with handling confidential customer information?,I understand the importance of maintaining confidentiality and have experience handling confidential customer information professionally and ethically. I am familiar with company policies and procedures for handling confidential information.,Average,Role Specific,Customer Service Skills
153,Customer Service Representative,How would you handle a situation where a customer is requesting a service that your company does not offer?,"If a customer is requesting a service that my company does not offer, I would apologize for the inconvenience and explain the services that we do offer.",Average,Situational,Customer Service Skills
154,Customer Service Representative,How would you handle a situation where a customer is asking for a discount or special pricing?,"I would explain the company’s pricing policies and any available promotions or discounts. If the customer is still unsatisfied, I would try to understand the reason for their request and offer alternative solutions, such as bundling products or services to create value for the customer. I would also try to balance the customer’s needs with the company’s profitability and pricing strategy.",Good,Situational,Customer Service Skills
155,Customer Service Representative,How many customers do you typically help in one day?,"In my previous role, I consistently assisted an average of 30 to 40 customers per day. I focused on maintaining a balance between providing quality service and ensuring timely resolution to meet the demands of a fast-paced environment.

On average, I helped approximately 25 to 30 customers per day in my previous position. I believe in prioritizing each customer interaction to ensure a personalized and effective resolution to their inquiries or concerns.

In my previous role, I typically assisted around 20 to 25 customers per day. I believe in dedicating the necessary time to each interaction to provide a high level of service, ensuring that every customer feels valued and their needs are addressed.

I am accustomed to handling a substantial volume of customer inquiries and have successfully assisted an average of 35 to 45 customers per day in my previous position. I am skilled at multitasking and maintaining a high standard of service in a fast-paced environment.

In my previous role, I consistently helped an average of 30 customers per day. I believe in the importance of efficiency without compromising the quality of service, ensuring that each customer receives the attention and assistance they deserve.",Good,Role Specific,Customer Service Skills
156,Customer Service Representative,"Do you handle phone calls, emails, and chats?","Yes, I have experience handling a variety of customer service channels, including phone calls, emails, and chats. In my previous role, I successfully managed and resolved customer inquiries across these different communication channels, adapting my communication style to suit the needs of each.

Absolutely, I am proficient in handling phone calls, emails, and chat interactions. In my previous position, I developed strong communication skills across these channels, ensuring a consistent and positive customer experience regardless of the platform.

Yes, I am well-versed in handling customer interactions through phone calls, emails, and chats. My previous experience involved efficiently managing inquiries across these channels, utilizing the unique aspects of each medium to provide effective and timely solutions.

Certainly, I have a proven track record of handling phone calls, emails, and chat support. I understand the nuances of each communication channel and can seamlessly switch between them to provide a cohesive and responsive customer service experience.

Yes, I am experienced in handling a diverse range of customer service channels, including phone calls, emails, and chats. My ability to adapt my communication style to different platforms has allowed me to effectively assist customers and maintain a high level of customer satisfaction.",Good,Role Specific,Customer Service Skills
157,Customer Service Representative,What is your process for helping a customer? Walk me through a recent customer issue.,"Active Listening: I start by actively listening to the customer's concerns. This involves allowing them to express their issue fully without interruption, ensuring that I understand the root cause and any specific details that might be crucial to resolution.

Empathy and Understanding: Once I have a clear understanding of the customer's issue, I express empathy and understanding. This helps build rapport and assures the customer that their concerns are acknowledged and taken seriously.

Clarifying Questions: I ask clarifying questions to gather additional details that may be necessary for resolving the issue. This ensures that I have a comprehensive understanding of the situation before proposing a solution.

Proposing Solutions: Based on the information gathered, I propose tailored solutions to address the customer's concerns. I ensure that the solutions offered are realistic, achievable, and align with the company's policies and guidelines.

Confirmation and Follow-up: After proposing a solution, I confirm with the customer to ensure they are satisfied and address any additional questions or concerns they may have. I then follow up to ensure that the solution implemented has successfully resolved their issue.",Good,Role Specific,Customer Service Skills
158,Customer Service Representative,Describe a typical work week.,"Monday:

Begin the week by reviewing emails and messages to address any urgent matters.
Prioritize tasks for the week, setting clear goals and objectives.
Conduct a team meeting to discuss ongoing projects, share updates, and outline priorities.
Tuesday:

Dive into project work, focusing on key deliverables and deadlines.
Schedule and attend collaborative meetings with team members to ensure alignment on project goals.
Allocate time for individual tasks and progress updates.
Wednesday:

Mid-week check-in with the team to assess project status and address any challenges.
Attend departmental meetings or training sessions as needed.
Use the afternoon for focused work on strategic planning or long-term projects.
Thursday:

Continue project work, ensuring tasks are on track and deadlines are met.
Collaborate with cross-functional teams to gather input and ensure project cohesion.
Review and respond to client or stakeholder communications.
Friday:

Finalize outstanding tasks for the week and conduct a personal review of accomplishments.
Participate in a team retrospective to assess the week's successes and areas for improvement.
Plan for the following week by outlining priorities and setting goals.",Good,Role Specific,Customer Service Skills
159,Customer Service Representative,How do you handle customer complaints in a professional manner?,"When a customer complaint arises, I strive to provide a professional and empathetic response. First, I listen carefully to the customer’s issue and validate their feelings. This helps to deescalate any potential conflict. Then, I apologize for any inconvenience caused and work with them to find a mutually beneficial solution. I also use active listening skills to ensure they feel heard and understood, and document all complaints in order to track them over time. My goal is always to come up with an agreeable resolution that results in a positive outcome for both parties.”",Good,Role Specific,Customer Service Skills
160,Customer Service Representative,What strategies do you use to ensure accuracy when dealing with customer information?,"I take accuracy and security very seriously when dealing with customer information. I always double-check all of the customer’s data before entering it into our system, and I verify any changes that customers or other agents make to ensure accuracy. Additionally, I use secure encryption methods for storing customer data in order to protect their privacy and adhere to company policies and industry regulations.”",Good,Role Specific,Customer Service Skills
161,Customer Service Representative, What experience do you have working in customer service?,"I have five years of experience working in customer service roles. In my most recent role as a customer service representative for ABC Insurance, I was responsible for responding to customer inquiries and complaints via phone, email, and live chat. I worked with customers from all over the world, so I’m very familiar with providing excellent customer service regardless of cultural differences. I also received specialized training in conflict resolution, which has been incredibly helpful in defusing difficult situations. My experience has taught me that customer service is about more than just solving problems—it’s about building relationships and creating a positive experience for every customer.”",Good,Role Specific,Customer Service Skills
162,Customer Service Representative,Can you tell me about your previous customer service experience?,"As you can see from my resume, I have worked in customer service for over four years. During this time, I have managed customers’ requests ranging from checking inventory for a different color product to troubleshooting software to fix an issue in the system. I have learned that friendliness and diplomacy are the best policy when speaking to a dissatisfied customer. I enjoy helping people and being able to turn an angry customer into a happy client.",Average,Role Specific,Customer Service Skills
163,Customer Service Representative,What skills does a great customer service representative need?,I believe and read customer service representatives needs competent problem-solving and communication skills. Communication skills are helpful when explaining policies to customers or answering their questions. Customer service representatives need problem-solving skills to help customers find solutions to various issues.”,Average,Role Specific,Customer Service Skills
164,Customer Service Representative,Can you tell me about your responsibility in your last position?,"As a customer service representative, my job was to assist customers with product information, help customers resolve any complain they may have about the product, engage customers that come physically, direct complains to the appropriate channel and make sure that I represent the brand image and that I keep up with the company standard while ensuring that customers are satisfied always”. In my last position as a content developer, I was responsible for creating all forms of content ranging from videos to text to infographics on our online platforms. I ensure that all contents on the platform pass through the company’s quality check”.",Good,Role Specific,Customer Service Skills
165,Customer Service Representative,what skills do you possess that will help you excel in this role,i excel at helping customers resolve issues and taking ownership of a situation to ensure fast and proper resolution i prioritize proactive and transparent communication during the entire process to help build trust and provide a great customer experience i am also very tech savvy so i can learn and navigate new systems quickly and even teach others tips and tricks to make the team more efficient,Average,Role Specific,Customer Service Skills
166,Customer Service Representative,what customer service tools are you aware of,it is important to have knowledge about crm tools as they help to search the previous contact history through which you can get the entire information of the customer or a particular issue that you are dealing with for example a phone number or bill detail can help you retrieve all the relevant information about the issue and help you in handling the situation better apart from this email phone social media platforms and live chat solutions are very helpful for customer management,Average,Role Specific,Customer Service Tools
167,customer service representative,what experience do you have with using customer service software,in my previous position i used a traditional point-of-sale pos system during every shift for a few weeks in this same position i worked remotely from home and got comfortable with using the companys live chat software where i was able to learn how to answer customers enquiries efficiently i enjoy learning about new technologies and i am very prepared to learn any new software that this organisation uses so that it can provide superior service to its customers,Average,Role Specific,Customer Service Tools
168,customer service representative,how proficient are you in customer service software,i am familiar with crm ticketing tools previously i have used them to track customer issues but i am keen to learn new software and tools to further my skills,Average,Role Specific,Customer Service Tools
169,customer service representative,as an experienced customer service representative tell me about your software proficiencies,i used squares ipad software in my previous role but i am a quick learner whos happy to gain experience with other programs,Average,Role Specific,Customer Service Tools
170,customer service representative,what customer service tools do you have experience using,i have previously provided customer service through email phone and social media i prefer to use phones and social media because most customers frequently use them makings them convenient,Average,Role Specific,Customer Service Tools
171,customer service representative,what customer service software do you have experience using,i have considerable experience using customer service software like zendesk for customer relationship management live chat software and jira for ticketing i also constantly research new tools and am willing to learn how your company makes customer service more efficient through automation,Good,Role Specific,Customer Service Tools
172,Customer Service Representative,What customer service software do you use?,"In my previous roles, I have had experience using popular customer service software such as Zendesk. I am proficient in leveraging its features to manage tickets efficiently, track customer interactions, and collaborate with team members to provide timely and effective solutions.

I am well-versed in customer service software, including but not limited to Salesforce Service Cloud. I have successfully utilized its capabilities to streamline customer support processes, track customer history, and ensure a seamless experience across various communication channels.

I have hands-on experience with customer service software like Freshdesk, where I managed and resolved customer issues, tracked performance metrics, and contributed to the continuous improvement of our support processes. I am adaptable to learning new systems quickly and efficiently.

In my previous roles, I have worked extensively with customer service software such as Help Scout. This platform has allowed me to effectively manage customer inquiries, collaborate with team members, and maintain a knowledge base for quick issue resolution. I am also open to learning and adapting to new software as needed.

I am familiar with customer service software such as HubSpot Service Hub, which I have used to streamline customer communication, manage tickets, and analyze customer feedback. My proficiency in leveraging these tools has contributed to improved efficiency and a better overall customer experience in my previous positions.",Good,Role Specific,Customer Service Tools
173,customer service representative,what is your experience with using chatbots or ai-powered customer service tools,i have extensive experience with using chatbots and ai-powered customer service tools these tools can be incredibly useful for providing quick automated responses to simple customer inquiries allowing our team to focus on more complex issues however it is important to balance the use of technology with the personal touch of human interaction so i always ensure that customers have the option to speak with a live agent if they prefer i am also familiar with the process of regularly updating and refining chatbot scripts to improve their accuracy and effectiveness,Good,Role Specific,Customer Service Tools
