,Job Position,Question,Answer,Answer Rating,Interview Phases,Skill Assessed
1,Customer Service Representative,What are Your Biggest Achievements?,"During my last job, I learned some interpersonal skills that improved how I communicate. It has also helped me work efficiently without any hindrance. Also, I can now manage a team in the absence of my manager.” ",Average,General,Accomplishments
2,Customer Service Representative,Name any Two Improvements You Made in the Previous Company.,"As a few of my team members were late to work, which impacted the work, I changed the login conditions by introducing timely login incentives. Hence, it improved the login time.”  There were a few people who used to miss the calls and sometimes used break aux and stayed on it for longer. Announcing a reward for the highest number of calls attended improved the work balance effectively.”",Good,General,Accomplishments
3,Customer Service Representative,Tell me about a professional accomplishment you’re proud of.,"One of my proudest professional accomplishments was leading a customer service initiative that resulted in a 20% increase in customer satisfaction within a six-month period. Through the implementation of targeted training programs and process improvements, we not only met but exceeded customer expectations.

I take pride in successfully managing a challenging situation where a key client was dissatisfied with our services. By proactively engaging with the client, identifying pain points, and collaborating with cross-functional teams, I was able to turn the situation around, ultimately retaining the client and strengthening our business relationship.

I played a key role in the implementation of a new customer feedback system in my previous role. The system not only streamlined the feedback collection process but also provided valuable insights that led to strategic improvements in our products and services. This accomplishment contributed to a more customer-centric approach across the organization.

In a previous position, I spearheaded a project to enhance the onboarding process for new customer service representatives. By developing comprehensive training materials and conducting targeted workshops, I significantly reduced the time it took for new hires to become fully proficient. This accomplishment not only improved team efficiency but also positively impacted overall customer service quality.

I take pride in successfully resolving a complex and long-standing customer issue that had previously eluded resolution. Through persistent investigation, collaboration with various departments, and effective communication with the customer, I was able to find a solution that not only satisfied the customer but also prevented similar issues in the future.",Good,General,Accomplishments
4,Customer Service Representative,Have you ever utilized customer feedback to enhance business operations?,"Yes, I've leveraged customer feedback to improve service processes, notably addressing long wait times by proposing a new call distribution system.",Average,Role Specific,Analytical mindset
5,Customer Service Representative,Have You Used Customer Feedback to Ensure Business Excellence?,"Yes, I have used customer feedback to improve customer service processes and address common pain points. I once received multiple complaints from customers about long wait times for phone support. I analyzed the customer feedback and discovered that the call queue management system is not effectively distributing calls among representatives, leading to bottlenecks and longer wait times. I shared this information with the relevant team and proposed a solution to implement a new call queue management system that intelligently distributes calls.",Good,Role Specific,Analytical mindset
6,Customer Service Representative,how do you make use of customers feedback,a feedback can be taken for many purposes such as product improvement training sale events etc as a customer care executive we are expected to study the data from the positive and negative feedback and utilize the same for several purposes for example if customers report a consistent flaw in a particular product a customer care rep can record this information and forward it to the concerned department who can make the required changes,Good,Role Specific,Analytical mindset
7,customer service representative,how valuable is a well-kept database or record of customer information and feedback,they are immensely valuable for csrs they not only help with solving issues at hand for particular customers but also provide wider insights which are useful for data analysis and tracking trends,Good,Role Specific,Analytical mindset
8,customer service representative,can you explain how you would use customer feedback to improve products or services,as a customer service executive i would collect and analyze customer feedback through various channels such as surveys reviews and social media by identifying recurring issues i would work with product and development teams to prioritize areas for improvement i would also provide feedback to relevant departments on specific customer needs or pain points to ensure that future products or services meet customer expectations,Good,Role Specific,Analytical mindset
9,customer service representative,how would you use data analysis to identify areas where the customer experience could be improved,as a customer service executive i would start by analyzing customer feedback and inquiries to identify any recurring issues or pain points i would also look at key metrics such as customer satisfaction scores and response times to identify areas for improvement by using data analysis we can better understand our customers needs and expectations and make data-driven decisions to improve the overall customer experience,Good,Role Specific,Analytical mindset
10,customer service representative,what is your experience with using sentiment analysis to monitor customer feedback,sentiment analysis can be a valuable tool for monitoring and analyzing customer feedback allowing us to identify patterns and trends in customer sentiment towards our products or services by using sentiment analysis we can quickly identify areas where we are excelling and areas that need improvement and adjust our customer service strategy accordingly to provide a better customer experience,Good,Role Specific,Analytical mindset
11,customer service representative,how would you use customer feedback to develop a customer retention strategy,to develop a customer retention strategy using customer feedback i would first analyze the feedback to identify common pain points and areas for improvement i would then work with the product and marketing teams to implement changes that address these issues and communicate these improvements to customers through targeted messaging additionally i would develop a system to proactively reach out to at-risk customers and provide personalized support to improve their experience and increase their likelihood of remaining a customer,Good,Role Specific,Analytical mindset
12,Customer Service Representative,what are your career goals,my goals include mastering the role of customer service representative with an eye toward management the next logical step would be to become a lead and oversee a small team to learn how to be a more effective manager,Good,General,Career Goals
13,customer service representative,where do you see yourself in three years,within three to five years i hope to have moved on to a customer service leadership position or managerial role within your organization since customer service is a critical element for the success of each business i would relish the chance to prove myself in a more senior role,Good,General,Career Goals
14,customer service representative,what are your career goalswhere do you see yourself in - years,i am currently working toward a marketing degree i hope to finish in the next three years i believe that experience in customer service will help me be an astute marketer who can anticipate clients needs,Good,General,Career Goals
15,customer service representative,where do you see yourself five years down the line,i would like to take on additional roles and responsibilities as i grow with the business i would love to explore options within the company and branch out into sales somewhere in the future,Average,General,Career Goals
16,customer service representative,where do you see yourself in five years,i am looking to progress to a managerial role over the next five years and advance my leadership skills i am also looking to take on more responsibilities as i grow in my role i love helping my colleagues find solutions to problems and in turn assisting customers this is how i would use my position to advance my career goals and add value to your organisation,Good,General,Career Goals
17,customer service representative,what are you hoping to do in five years,i hope to progress from customer service assistant to manager within this company in five years i enjoy the responsibilities and team environment involved with working in customer service which is why i believe this position is a great fit for me and my career ambitions,Good,General,Career Goals
18,customer service representative,what are you hoping to do in five years,i would love to work as a manager in this company in the next five years i think working in customer service is absolutely vital since i will get such a great feel for what customers need and want i enjoy the responsibilities of working as a customer service representative so i think this position is a great fit for me and my career ambitions,Good,General,Career Goals
19,Customer Service Representative,What are Your Career Goals?,I am passionate about customer service and see this position as a stepping stone to my long-term goal of becoming a customer service manager. I believe my skills and experience will enable me to excel in this role and make a significant contribution to the company.,Good,General,Career Goals
20,Customer Service Representative,What are your long-term career goals?,"My long-term career goals include continuing to develop my skills and knowledge in customer service, potentially moving into a leadership role, and contributing to the success of the organization in a meaningful way. I am committed to professional growth and lifelong learning.",Good,General,Career Goals
21,Customer Service Representative,How does this job fit in with your career aspirations?,"Relevant Skills Utilization: The role requires skills and experiences that I have acquired in previous positions, allowing me to apply and further develop these skills. This alignment ensures that I can contribute effectively from day one.

Career Progression: The responsibilities and challenges associated with this job align with my long-term career goals. This role presents opportunities for growth and development, allowing me to progress along a path that aligns with my aspirations.

Industry Alignment: The job is in an industry or field that I am passionate about. Being in an environment that aligns with my interests ensures that I am motivated to make meaningful contributions and stay engaged in my professional journey.

Learning Opportunities: The position offers opportunities for continuous learning and skill development. I am enthusiastic about roles that encourage personal and professional growth, and I believe this job will provide the challenges and learning experiences necessary for my advancement.

Contributing to Company Objectives: The company's mission, values, and objectives resonate with my own professional values. I see this role as an opportunity to contribute meaningfully to the organization's success while aligning with my career aspirations.",Good,General,Career Goals
22,Customer Service Representative,how do you respond when you do not know the answer to a question,it is important to be transparent with the customer but there are ways to phrase the communication to include a positive spin i like to say something like that is a great question i will find the answer for you including a time that they can expect a follow-up is always a great practice,Good,Situational,Communication Skills
23,Customer Service Representative,tell me about a time when you had to deliver bad news to a customer,i had a situation where the customers delivery was lost in transit but the order showed it was delivered the customer reached out and was angry because they were supposed to have gotten their order a few days earlier it was a personalized item so replacing it would be a challenge,Good,Situational,Communication Skills
24,Customer Service Representative,how would you handle a situation where you have to reach out to the customer about an issue without having all the information or answers,it is important to begin the interaction with an apology for not having all the information from there i would communicate all the information we do have making sure to be transparent and let them know when to expect the next update i would ask the customer if they have any questions comments or concerns and i was sure to listen carefully to their response and answer any questions the best i can,Good,Situational,Communication Skills
25,customer service representative,has there ever been a situation in which you or a past organization received a negative review or feedback from a customer how did you respond,i strive to continually improve my customer service skills and i take negative feedback very seriously,Bad,Situational,Communication Skills
26,customer service representative,give me an example of a time when you had to explain something fairly complex to a frustrated client or coworker how did you make sure they understood you,as a customer service representative for verizon i once had a customer who wanted to reduce their bill they were already on the most inexpensive plan available but they were also paying 100 monthly for financing their phones i printed a copy of their most recent bill and explained each component i also pointed out that their financing program would be paid in full in just a few months after which point their monthly payments would decrease they left satisfied and informed about their circumstances,Good,Situational,Communication Skills
27,customer service representative,tell me about a time you thought you communicated clearly but were misunderstood what happened and how did you handle the situation,when i worked in a department store i once told a customer that we were offering a 25 discount on all clothing on the clearance rack they seemed excited and headed directly for a rack of full-price sweaters i walked over and gently told them that a few sweaters qualified for the 25 discount on the clearance rack nearby when they realized the miscommunication they were glad i stepped in quickly,Good,Situational,Communication Skills
28,Customer Service Representative,Has this Ever Occurred that You are Trying to Communicate Something Which Was Later Misunderstood?,"Once a customer was making a hotel booking, and he called to know if there was any coupon code he could apply to get more discount. Upon checking, I came up with a coupon of up to 40% discount and conveyed the same to the customer. He misunderstood my message and thought it would give him a flat 40% discount. He called again and complained about not getting a 40% discount on the price. I realized that he did not understand it. So, I informed him clearly and thoroughly again.” ",Good,Situational,Communication Skills
29,Customer Service Representative,How Would You Explain Twitter to Your Grandparents?,"On Twitter, you can share your thoughts and see what others share. You must create an account using your email ID or phone number, which will be protected using a password. Once done, you can customize your profile by adding your bio, profile picture, etc. Here, you can tweet, which has certain character limits. You can also engage with others by commenting, liking, or retweeting their posts. Also, this platform has the highest hashtag usage, making a post viral and trending.” ",Average,Situational,Communication Skills
30,Customer Service Representative,Have You Ever Faced a Situation Where the Customer’s Demand was Unclear?,"No, I always try to follow the customer and guide them if they are confused. I put options for them to ensure they get exactly what they want. I ask them follow-up questions to ensure I listen to their queries and requests.”",Average,Situational,Communication Skills
31,Customer Service Representative,How would you describe your communication style?,"My communication style is clear, concise, and professional. I am able to adapt my communication style to the needs of the customer, whether they prefer a formal or informal approach.",Good,General,Communication Skills
32,Customer Service Representative,How do you ensure that your communication is effective?,"I ensure that my communication is effective by actively listening to the customer, asking clarifying questions, and confirming understanding. I also strive to use clear and concise language and avoid technical jargon.",Good,General,Communication Skills
33,Customer Service Representative,"How do you handle communication barriers, such as language differences?","When dealing with communication barriers, such as language differences, I strive to find a common language that both parties can understand. I may use translation tools or seek assistance from colleagues who are fluent in the customer’s language. I also use clear and concise language and avoid technical jargon to ensure that the customer understands the information.",Good,General,Communication Skills
34,Customer Service Representative,"What is your experience with handling communication through different channels, such as email, chat, and phone?","I am experienced in handling communication through various channels, including email, chat, and phone. I am able to adapt my communication style to the specific channel and ensure that the customer’s needs are met through each mode of communication.",Good,Situational,Communication Skills
35,Customer Service Representative,What is your experience with public speaking or presenting to groups?,"While not directly related to customer service, I have experience with public speaking and presenting to groups. I am comfortable speaking in front of others and can present information clearly and concisely.",Good,General,Communication Skills
36,Customer Service Representative,What is your experience with social media and online communication?,I am experienced with social media and online communication and can communicate effectively through these channels. I am able to adapt my communication style to the specific channel and ensure that the customer’s needs are met through each mode of communication.,Good,General,Communication Skills
37,Customer Service Representative,How would you sell me one of our products or services?,"I approach selling our products or services with a thorough understanding of the customer's needs and preferences. Building rapport is key, involving active listening and genuine interest in their requirements. I carefully highlight the unique benefits and value propositions of the offering, emphasizing how it directly addresses the customer's pain points. Demonstrating expertise, I draw on my knowledge to address concerns and showcase the product/service's capabilities. Proposing a customized solution, tailored to the customer's requirements, ensures a seamless alignment with their needs.

In selling our products or services, I begin by researching the customer's needs and prior interactions with our company. Building rapport is essential through active listening and open-ended questions. I emphasize the benefits and unique value propositions of the offering, demonstrating its relevance to the customer's specific pain points. With expertise in the product/service, I address concerns and showcase capabilities. Proposing a customized solution, I tailor options to the customer's requirements for a seamless fit.

My approach to selling our products or services involves thorough research on the customer's needs. Building rapport is foundational, employing active listening and a genuine interest in their requirements. I emphasize the benefits and unique value propositions of the offering, directly connecting them to the customer's pain points. Demonstrating expertise, I address concerns and showcase the product/service's capabilities. Proposing a customized solution tailored to the customer's requirements ensures a solution that seamlessly aligns with their needs.

When selling our products or services, I prioritize understanding the customer's needs and preferences. Building rapport is crucial, incorporating active listening and a genuine interest in their requirements. I highlight the benefits and unique value propositions of the offering, directly tying them to the customer's specific pain points. Demonstrating expertise, I address concerns and showcase the product/service's capabilities. Proposing a customized solution, tailored to the customer's requirements, ensures a solution that seamlessly aligns with their needs.

In the sales process for our products or services, I begin with thorough research on the customer's needs and preferences. Building rapport is key, involving active listening and genuine interest in their requirements. I carefully highlight the benefits and unique value propositions of the offering, emphasizing its direct relevance to the customer's pain points. Demonstrating expertise, I address concerns and showcase the product/service's capabilities. Proposing a customized solution, tailored to the customer's requirements, ensures a seamless alignment with their needs.",Good,General,Communication Skills
38,Customer Service Representative,"What communication methods do you think are the most important when undertaking customer service, and why?","I would say that listening is one of the most important things when it comes to communicating with customers. You can speak clearly and eloquently, but if you don’t also listen to what a customer is saying you will still find that situations won’t always have the outcomes that they should. By making sure to really listen to others, you can identify the root cause of an issue and often it will help you to find the solutions which really work.",Good,Role Specific,Communication Skills
39,Customer Service Representative,Why are You Interested in This Company?,"I think I can use my skills better in this company. With new people and minds, it will be exciting for me to manage them and create a team of efficient employees. Also, as checked, your service is the best in the market, and working with such a reputed company would be great.”",Average,Introduction,Company Research
40,Customer Service Representative,What made you want to apply to this position and our company?,"I was drawn to this position because of the strong emphasis your company places on delivering exceptional customer service. Your commitment to customer satisfaction aligns with my own values, and I am excited about the opportunity to contribute to a team that prioritizes the customer experience.

Your company's reputation for innovation and commitment to providing outstanding customer service is what initially caught my attention. After researching more about your values and achievements, I became even more enthusiastic about the prospect of joining a team that shares my passion for excellence in customer interactions.

I applied to this position because I was impressed by your company's commitment to fostering a positive work environment and delivering top-tier service to your customers. I believe my skills and experience align well with the values of your organization, and I am eager to contribute to the continued success of your team.

The company's focus on continuous improvement and its dedication to creating meaningful customer experiences are what attracted me to this position. I am excited about the opportunity to contribute to a company that values innovation and is dedicated to maintaining high standards in customer service.

I applied to this position because I believe in the mission and vision of your company. The emphasis on quality service, combined with the collaborative and dynamic work culture you promote, aligns with my career goals. I am enthusiastic about the chance to contribute to the success of your team and grow with the company.",Good,Introduction,Company Research
