Position/Role,Question,Answer,Interview Phase,Answer Quality
Sales Manager,Has a manager ever given you too much work? What did you do?,"Everyone will have moments in their career where their workload is heavier than normal. I’ve found that this can happen for a lot of reasons and being adaptable can go a long way. A few years ago, one of my colleagues ended up leaving our company for a different opportunity. Naturally, we all had to step up to take on some extra work while waiting on her backfill. I ended up being asked to take on a lot of her administrative work. There were a lot of small things that, especially when added to my existing workload, became too much for me to handle. After giving it my all for a few weeks, I ended up scheduling time with my manager to discuss my bandwidth. We worked together to prioritize my tasks based on our team’s goals and he helped me delegate.",Behavioral,Good
Sales Manager,Have you ever been on a team where someone was not pulling their own weight? How did you handle it?,I think anyone who has ever worked on a team has worked with an underperforming coworker—that’s just par for the course. What I’ve learned is that empathy will take you a long way. I had a coworker in my last role who routinely missed deadlines which would push the rest of our team behind. I decided to sit down with them and try to understand why they were unable to meet project timelines. I learned in that conversation that they hadn’t been properly trained on our project management software and didn’t have a good line of sight into due dates. I was able to help them access training resources and answer some of their questions.,Behavioral,Good
Sales Manager,Have you ever been overwhelmed with work? How did you handle that situation?,"I have experienced being overwhelmed with work. Earlier in my career, I had a really hard time with setting boundaries in terms of communicating my capacity to take on more work and would frequently find myself with more to do than I could handle. This inevitably led to burn out and I had to reassess my approach to work. Not only did I learn how to better prioritize my tasks, but I also gained important communication skills that help me work with my team and manager to balance new work with existing projects.",Behavioral,Good
Sales Manager,"Have you ever changed a process to improve efficiency, lower costs, or increase revenue?","Yes, I implemented a new lead qualification system that increased our conversion rate by 20% and reduced costs.",Technical,Average
Sales Manager,Have you made mistakes in your previous position as a sales manager? How did you handle it?,I have made mistakes as a manager in handling a difficult employee. I learned a lot from this and have taken extra steps in communication to make sure that similar communication issues don’t occur again.,Behavioral,Average
Marketing Manager,How did you get into social media?,"I used social media to connect with people for over a decade before deciding to get into social media management as a career three years ago. I saw the innovative ways social media managers connected with a brand's target audience and that appealed to me. After discovering my creative- and strategic-thinking skills, I knew a career as a social media manager was perfect for me.",Technical,Average
Sales Manager,How did you hear about this position?,I have been following your company on LinkedIn for a while now was recommended the job listing in a notification shortly after it was published. I knew I wanted to submit my resume after reading about the contributions this role will be able to make towards customer retention and engagement.,Introductory,Poor
Marketing Manager,How do you approach developing a marketing strategy aligned with overall business objectives?,"My approach starts with a comprehensive understanding of the company's overarching goals and market positioning. I collaborate closely with key stakeholders across departments to align marketing objectives with broader business objectives. By conducting SWOT analyses, market research, and competitor assessments, I identify opportunities and challenges. I then formulate a strategy that integrates marketing initiatives to support these objectives. Regular performance tracking and KPI alignment ensure that our marketing efforts directly contribute to achieving the company's goals.",Technical,Good
Marketing Manager,How do you approach developing a marketing strategy aligned with overall business objectives?,I try to understand the company's goals and then create marketing plans that support those goals. I regularly communicate with other departments to ensure alignment.,Technical,Average
Marketing Manager,How do you approach developing a marketing strategy aligned with overall business objectives?,I just create marketing plans based on what I think is best for the company.,Technical,Poor
Marketing Manager,How do you decide what kind of content to write or display on the website?,What I create is based on what the company offers and what consumers need. The right SEO content makes the perfect bait.,Technical,Good
Marketing Manager,How do you decide when to stop investing in a brand strategy and move on to another idea?,"One of the challenges about brand management is that it takes time to solidify a brand, so we may not see the impact of a campaign until it has been running for a while already. I would carefully track metrics over time and look for small trends to indicate the future impact of the project. If we fail to meet multiple benchmarks, I would start transitioning away from that project.",Technical,Good
Sales Manager,How do you delegate?,"In my previous position, it was my first time managing a team at work. I quickly learned the value of delegating because I thought I could do it all without help but realized my team members were capable and sharing responsibilities was efficient. I asked my manager to help me find my delegation strategy, so I can use it with my team and found that collaborative delegation works for me. After that, I held a team meeting where we discussed the assignments we needed to complete so we can finish a project by its deadline in two months. We had team members volunteer to work on some assignments together so they could combine their skill sets. Others took tasks in which we knew they were going to be successful. Then we talked about when our check-in dates were going to be as an effort to ensure everyone was on task and following the directions. After they completed their tasks, we all had another meeting to discuss any feedback and give each other recognition for their work.",Behavioral,Good
Sales Manager,How do you delegate?,"I value delegating tasks at work very much because it helps complete assignments quicker. I've also found it instills confidence and motivation in my team when I trust them enough to give them more responsibility at work. I look at everything we desire to complete and figure out who I'm going to give what task. Then I go to the person I feel can complete the task best based on their skill set and their experience. When I approach them, I ask if they feel comfortable adding another task to their list so I can respect their boundaries. At my first managing job, I had someone share with me they didn't have the space to take on a new task at this moment and I respected their honesty. After that, I went to my next choice of who I thought would do well with the assignment. This allowed both team members to finish their respective tasks on time and do well because they had the proper space and time to complete them. I feel like I'm very good at delegating because I consider my decisions carefully and communicate well with team members.",Behavioral,Good
Marketing Manager,How do you determine which features you should add to your product?,"When I'm determining which additions to add to a product, I'll typically start by conducting research on our current users. I'll review insights to determine which features they're currently using the most and will determine what type of updates I can add to make that specific feature more enjoyable for them. Another method I use is reviewing the comments and feedback that users will leave on our software or the input they provide our sales or customer service teams. I'll use these to determine what can be added to enhance they're overall experience.",Technical,Good
Marketing Manager,How do you develop and track the success of a marketing campaign?,"In my experience, I developed marketing campaigns by collabourating with other people on my team. It almost always involved having a meeting and sharing ideas back and forth to identify what the best marketing strategies were for our specific goals. I tracked the success of these campaigns by periodically gathering sales data and seeing which marketing campaigns boosted sales the most.",Technical,Average
Sales Manager,How do you keep up with latest trends and developments in your field of expertise?,I regularly read several newsletters that cover different marketing disciplines and industry trends. I recently read an article outlining the latest best practices for A/B Testing on Facebook and found it was really informative.,Technical,Good
Marketing Manager,How do you keep up with the latest strategies for engagement and social media developments?,"Staying up-to-date with new developments, strategies and social media platforms is an important aspect of my job. I update my newsfeed regularly, subscribe to magazines, follow trade journals and network with other social media managers. Over the years, I learned that the best way to stay current is by interacting with other social media professionals.",Technical,Good
Marketing Manager,How do you know if the company’s website content is successful in its mission?,"I’ve used Google Analytics to monitor website progress. Design is important once visitors land, and the challenge is using the right words to get them there.",Technical,Good
Marketing Manager,How do you know when a campaign is successful?,"I strongly believe that there is no successful campaign without clear goals set at the start of it or during the planning process. Knowing campaign goals, which define success, helps to focus on important KPIs, track campaign progress as we go and measure overall success rate at the end, whether it's the increase in sales or more leads from online ads.",Technical,Good
Marketing Manager,How do you know when a product is designed well?,"A product is well-designed when it’s simple, intuitive and promises what it delivers. Consumers should be able to use it out of the box without thumbing through a hundred pages in a manual. Plus, a well-designed product today should be environmentally friendly. I shouldn’t be able to notice a waste of resources such as excessive packaging.",Technical,Good
Sales Manager,How do you maintain work-life balance?,"My time management skills are a life-saver when it comes to my ability to maintain work-life balance. Because I am able to use my time effectively during the workday, I find that I am able to enjoy my personal time without having to think too much about work, and vice versa. It’s also a blessing that I work in a field that I love, because I get to wake up each day and look forward to going to work.",Behavioral,Good
Sales Manager,How do you make decisions? Describe your approach to a recent decision you have made.,"I want to gather as much information as I can before making a decision, but I also take my time constraints into account, knowing that most work decisions need to be made quickly, even if not all information is available. I try to carefully review all options and explore what the outcomes of each choice might be. I use the information at hand to choose an outcome that is fair and reasonable for the situation.",Behavioral,Good
Marketing Manager,"How do you manage a new product launch? What tactics, strategies and processes do you use?","I develop a launch plan based on input from teams such as support, testing and product management. I also seek advice from key stakeholders when setting a schedule with dates and deliverables. I hold weekly meetings as the launch date approaches to ensure everything is on track. I also check that we’re staying on track by continuing to design and market the product toward the right audience.",Technical,Good
Marketing Manager,How do you manage multiple clients at the same time?,"In my past roles, I have been responsible for as many as 10 clients at once. I identify their expectations from the beginning of every project and prioritize assignments based on each client's schedule. I also use client management software to provide regular updates and solicit feedback that can improve project results.",Behavioral,Good
Sales Manager,How do you manage multiple social media accounts?,"In my previous role, I handled the company's Twitter and Facebook accounts. I learned that creating unique content for different platforms keeps a target audience engaged. Typically, I plan social media posts one month before I post them. However, I leave soon room to include relevant content if something is trending or urgent. I keep the same voice across all channels while developing different content. Also, I develop specific strategies to meet the expectations of the target audience.",Technical,Good
Sales Manager,How do you manage social media budgets?,"In my previous role, the upper management team allocated a monthly budget for social media campaigns. I used various budget-tracking software and Google Analytics to make sure I didn't overspend on any strategy or campaign. I also set smaller budgeting targets to keep me on track.",Technical,Good
Sales Manager,"How do you manage team assignments, professional development and conflict resolution?",I evaluate my team’s experience levels and try to find work that is challenging but not overwhelming. Listening is important in managing conflict resolution.,Behavioral,Good
Marketing Manager,How do you manage the relationship between customers and the company? ,"I manage the relationship between customers and companies by using social media channels to directly connect with customers and identify what they like about our products, what they want to see, and how they believe we can improve on what we provide. I think it's also really important to maintain customer relationships for financial longevity. So implementing incentives like customer reward programmes is a way I would help manage the relationship in a positive way.",Behavioral,Good
Marketing Manager,How do you measure success in a product launch?,"Data is absolutely the best way to see if a launch was successful or not. The metrics I choose to use depend on the type of product and type of launch we're undertaking. For example, in the past I did a launch of a brand new product. I tracked the social engagement versus the actual number of purchases before and after the launch to see how effective our online strategies were. I would take a different approach if we were relaunching an existing product since the marketing campaign would differ substantially.",Technical,Good
Sales Manager,How do you motivate others?,"My approach to motivation is to focus on building an atmosphere of motivation, rather than trying to motivate team members when the situation calls for it. To do this, I encourage teamwork by planning and taking part in team-building exercises. I promote collaboration and help my staff members identify and celebrate each person's strengths and achievements.",Behavioral,Good
Sales Manager,How do you motivate others?,"On the weekends, I also work as a yoga and fitness instructor and teach small classes. Motivating is a huge part of my job as a health coach, and I take it very seriously. Through my experience as a professional motivator, I've learned to identify the aspects of each person's life that can help them build intrinsic motivation. I believe helping people develop inner motivation is more important than motivating them externally, and that's what separates me from other fitness coaches and other business administrators.",Behavioral,Good
Sales Manager,How do you motivate others?,I motivate my team by telling them to work harder and offering them incentives like cash bonuses if they meet their targets. Fear of losing their jobs also keeps them motivated.,Behavioral,Poor
Marketing Manager,How do you narrow in on the best target consumer sector for your products?,"I first analyze the product and the problem that it solves. Then, I dive into user data to see which consumers would benefit the most from the product and have the spending power to purchase it.",Technical,Good
Sales Manager,How do you navigate personality conflicts with clients?,"My natural leadership skills make it easy for me to work with clients who aren't necessarily sure what they want. I can use my industry expertise to provide the appropriate recommendations and educate them about their options. In the past, I've worked with stubborn clients who are hesitant to listen to recommendations. I've overcome this challenge by practicing active listening skills and assuring them that I have their best interests in mind.",Behavioral,Good
Sales Manager,How do you plan and manage your work when you have multiple conflicting priorities?,"I have frequently found myself in situations where I have had to juggle several competing tasks. One method that I have found to be helpful is using the Eisenhower Matrix to prioritize based on importance and urgency. I am a visual person, so being able to physically divide my responsibilities into different quadrants helps me better understand the scope of work at hand and make decisions about how to best use my time.""",Behavioral,Good
Sales Manager,How do you respond to stress or change?,"I am able to stay calm by focusing on the bigger picture first and then breaking down my projects into smaller tasks. I always start by identifying the ultimate goal I am trying to achieve. From there, I make a list of short and long-term action items that will get me to my final goal.",Behavioral,Good
Marketing Manager,"How do you set a communications strategy for a company, and what are the most important components?",My role as a communications manager is really to support broad business goals with a high-level communications strategy. Tactics must be measurable and complement the overall company goals.,Technical,Good
Marketing Manager,"How do you stay up-to-date on which trends, challenges and memes are currently popular and implement them in your own content?","As a marketing manager, I need to know not only when trends become popular, but also when they fall out of style. I make sure that I'm aware of what kinds of content are currently trending by following pages that are popular among my target audience on all platforms. I spend time reading through my feed and making note of the patterns I see that I can then reference in images and text posts.",Technical,Good
Sales Manager,How do you stay updated on industry trends and changes in the sales landscape?,"I have a multifaceted approach to staying updated on industry trends. I regularly attend industry conferences and workshops to network, learn from experts, and gain insights into emerging trends. Additionally, I subscribe to reputable sales journals and online publications. I'm an active member of sales forums and engage in continuous learning through online courses, webinars, and podcasts. I also encourage my team to share insights and collaborate on staying informed, fostering a culture of knowledge sharing.",Technical,Good
Sales Manager,How do you stay updated on industry trends and changes in the sales landscape?,I usually check industry news websites and occasionally attend webinars or seminars related to sales.,Technical,Average
Sales Manager,How do you stay updated on industry trends and changes in the sales landscape?,I don't actively seek industry updates. I usually rely on what my colleagues mention during team meetings.,Technical,Poor
Marketing Manager,"How do you stay updated on marketing trends, and how do you incorporate these trends into your strategies?","I prioritize continuous learning through various methods. I regularly attend industry conferences, subscribe to reputable marketing publications, and engage in webinars and podcasts by industry leaders. Additionally, I actively participate in professional networking groups and online forums where marketing professionals share insights and discuss emerging trends. I believe in critically evaluating these trends against our current strategies, conducting pilot tests, and implementing those that align with our brand and audience. This approach ensures that we're agile in adopting new strategies while ensuring they fit our brand's narrative and goals.",Technical,Good
Marketing Manager,"How do you stay updated on marketing trends, and how do you incorporate these trends into your strategies?","I try to read marketing blogs and follow industry news. If I find something interesting, I discuss it with the team to see if it fits our plans.",Technical,Average
Marketing Manager,"How do you stay updated on marketing trends, and how do you incorporate these trends into your strategies?",I do not actively seek out marketing trends. I usually follow what competitors are doing and try to replicate it.,Technical,Poor
Sales Manager,How does this position fit your career goals?,"My primary career goal is to eventually lead employee engagement efforts to help businesses foster employee-centric company cultures. Basically, I just want to help people love where they work. This role's specific focus on employee retention seems like a natural next step that would allow me to contribute meaningfully to the team while still being able to expand my experiences and skills.",Introductory,Good
Marketing Manager,How does website content influence the company as a whole?,You can propel a company’s reputation by displaying content specifically tailored for their targeted audience. I’ve learned that educating and engaging prospective clients works wonders.,Technical,Good
Sales Manager,How much experience do you have with writing training manuals or other reference documents for sales teams?,"I have written several training manuals that cover everything from product knowledge to sales techniques, which have been very beneficial for onboarding new team members.",Technical,Average
Marketing Manager,How often do you post on social media on a personal or professional level?,I use Facebook and Instagram for socializing among friends and LinkedIn for socializing among colleagues. I’m always posting information to inspire or help others.,Technical,Good
Sales Manager,How will you handle managing former colleagues?,"I would set expectations for the team on day one. If I were working with former colleagues, I would call an all-hands meeting to set up these expectations. It would be important for them to know that there are changes I would want to make, even though I will still be part of the team and participate in demos and making calls. It’s important for my colleagues to know that they can come talk to me as their manager whenever they need.",Behavioral,Good
Sales Manager,How will you manage the different personalities on your team?,"The first step to working with a team is getting to know them. In my first two weeks as a manager, I would set up one-on-one meetings with every member of my team and ask how they typically communicate with their manager, what their working hours are and what their working style is like. I would then try to establish a positive environment for everyone by letting them know I am open to chatting whenever they need, and implement strategies that play to each individual’s strengths.",Behavioral,Good
Sales Manager,How will you turn a C player in to an A player?,"Asking questions is a really good way to prompt a sales rep to think about how they can improve their tactics. For example, with a sales rep who struggles with communication cadence or identifying leads, I can help them with coaching and reviewing calls. Setting realistic quotas is also a big part of making sure people can meet their goals.”  ",Behavioral,Good
Sales Manager,How would the top performer on your team describe you?,"I think our top performers would describe my management style as encouraging, resourceful and democratic. In my most recent sales management position, I helped one of the sales reps close a deal worth a lot of money by coaching them on follow-up communication and how best to describe the product.",Introductory,Good
Sales Manager,How would you deal with a sales rep who was underperforming?,I would first identify the reasons for underperformance through one-on-one meetings and then develop a performance improvement plan.,Behavioral,Good
Marketing Manager,"How would you describe our product to someone who wanted something similar, only $20 cheaper?","For only $20 more, you get at least $100 more worth of features with this product. For example, it syncs to your smartphone, computer and other devices to save you a lot of time and hassle. Our users also say that they love the ability to control it when they’re at home or on vacation. Also, they rarely have to contact customer support for help with an issue.",Technical,Good
