Position/Role,Question,Answer,Interview Phase,Answer Quality
Sales Manager,A specific product hasn't sold well and you have a lot of inventory left over. What strategies do you implement to sell it and earn a profit?,"First, I would look at the placement of the product, move it closer to the front of the store and redesign the display to attract interest from customers. I would also ask my staff to focus on selling that particular product and create a few phrases for them to include in conversations. If this doesn't work, I would consider placing the item on sale.",Technical,Good
Marketing Manager,Are rich snippets important for SEO?,"Having rich snippets can help search results stand out and increase the click-through rate. In the long run, it can positively affect page ranking, too.",Technical,Average
Sales Manager,Are you a team player?,"I am absolutely a team player. My perspective has always been that if my team succeeds, I succeed, and if I succeed, my team succeeds. I think work is a lot more fun when you’re sharing your time and energy with people who want to raise each other up.""",Introductory,Good
Sales Manager,Are you comfortable with analyzing data?,I’ve grown accustomed to analyzing data because I believe it’s crucial to understanding the sales process. I typically use previous data to conduct analysis on past sales. Both historical sales data and data surrounding the product itself will empower me and my team to set realistic quotas and accurately forecast sales plans.,Technical,Good
Marketing Manager,Are you comfortable with public speaking? What examples can you provide from your previous roles?,"Yes, I am comfortable with public speaking. In my previous roles as a publicist and a PR specialist, I had several opportunities to act as a spokesperson for my employer at press conferences or interviews with local news stations. I have experience drafting press release statements and issuing those statements in response to legal issues, product launches or local initiatives that involved my employer.",Behavioral,Good
Sales Manager,At what point would you advise a sales rep to stop pursuing a customer?,"If after multiple follow-ups and a product demo the customer is still not engaged or showing interest, it might be time to move on to more promising leads.",Technical,Good
Marketing Manager,"Can you describe a successful marketing campaign you developed and executed? What was the strategy, and what were the results?","In a previous role, I encountered a client who was dissatisfied due to delivery delays. I initiated immediate contact, expressing empathy and understanding for their concerns. I took responsibility for the delays and outlined a detailed plan to rectify the situation, ensuring clear communication throughout. I offered compensation and incentives to regain their trust. By consistently updating them on progress and ensuring a smoother process for future deliveries, we not only retained the client but also received positive testimonials highlighting our commitment to customer satisfaction.",Technical,Good
Marketing Manager,"Can you describe a successful marketing campaign you developed and executed? What was the strategy, and what were the results?","I once had a client who was unhappy with our service. I spoke to them, apologized for the inconvenience, and offered some discounts on their next purchase. After that, they seemed okay.",Technical,Average
Marketing Manager,"Can you describe a successful marketing campaign you developed and executed? What was the strategy, and what were the results?","I had a difficult client, but I couldn't do much about it. It was a tough situation.",Technical,Poor
Sales Manager,Can you describe a time when you had to respond to a problem at work?,"When I’m faced with a challenge at work, I try to rely on data and logic when I’m coming up with my response. As an example, in my last role we saw a sudden decline in our social media engagement. I was tasked with assessing our strategy and identifying where we needed to shift. I analyzed recent performance for our own pages and how our competitors were performing. By researching platform best practices and applying them in a way that was still consistent with our brand, we were able to turn performance around and end the quarter with strong engagement numbers. We learned a lot from that exercise and it confirmed for leadership that more regular analysis of our social media strategy was needed to keep performance strong on those channels.",Behavioral,Good
Sales Manager,Can you describe a time when you led by example?,"I think that oftentimes, the best opportunities to lead by example are all in your attitude. A big pet peeve of mine is actually when people have a bad attitude about work—not that it’s not okay to be frustrated or even to complain sometimes, but I always try to focus on being productive with those feelings. How can we turn this negative situation into a positive one? How can this thing you’re frustrated with be changed into a good learning experience for you or someone else on the team?",Behavioral,Good
Sales Manager,Can you describe your preferred method for keeping track of inventory and sales?,I like using a cloud-based POS system because the ability to access important information from anywhere lets me track things more closely.,Technical,Good
Marketing Manager,"Can you discuss a time when a marketing campaign didn't perform as expected? How did you handle it, and what did you learn from the experience?","I led a campaign targeting a new demographic, but the results fell short of our expectations. I immediately conducted a thorough analysis of campaign metrics, audience feedback, and compared it to our initial projections. Identifying that the messaging didn't resonate well with the audience, I organized focus groups and surveys to gather direct feedback. We then adjusted the campaign's messaging and visuals to better align with their preferences. Although the initial results were below par, the revised campaign eventually saw a 25% increase in engagement, showcasing the value of listening to audience feedback and making necessary adjustments promptly.",Technical,Good
Marketing Manager,"Can you discuss a time when a marketing campaign didn't perform as expected? How did you handle it, and what did you learn from the experience?","Once, a campaign I worked on didn't meet our expectations. We tried to figure out why and made some changes. It did better after that.",Technical,Average
Marketing Manager,"Can you discuss a time when a marketing campaign didn't perform as expected? How did you handle it, and what did you learn from the experience?",I never had a campaign fail on me. All my campaigns were successful.,Technical,Poor
Sales Manager,Can you give specific examples of how you got to know members of your team well enough to assign prioritized sales leads effectively?,I hold individual daily meetings and regular team events to know my team's capabilities. I assign leads based on closing rates and common interests.,Technical,Good
Sales Manager,Can you share an example of a sales strategy you developed that resulted in significant revenue growth or improved performance?,"In my previous role, I identified an untapped market segment and devised a targeted inbound marketing strategy leveraging content marketing and social media. I collaborated with the marketing team to create tailored content addressing pain points of this segment. We launched a series of webinars, blog posts, and social media campaigns. This approach not only increased our brand visibility but also resulted in a 40% increase in leads from that segment within six months, translating to a 25% boost in revenue.",Technical,Good
Sales Manager,Can you share an example of a sales strategy you developed that resulted in significant revenue growth or improved performance?,I implemented a new sales approach that focused on following up with leads more promptly. This helped in increasing our sales numbers.,Technical,Average
Sales Manager,Can you share an example of a sales strategy you developed that resulted in significant revenue growth or improved performance?,"I don't remember a specific strategy I developed that led to significant growth, but I always try to improve our sales processes.",Technical,Poor
Sales Manager,Can you tell me about a difficult work situation and how you overcame it?,“My boss had a family emergency and needed to be out of the office for two weeks without advance notice. Our biggest client had already made plans to visit our office during that time to hear an ad campaign pitch and was concerned that no one else in the office would be up to speed on the project before the deadline. I scheduled an immediate video call with the client to assure them I could represent my boss’ pitch in the meeting. I even made a point of mentioning the client’s specific parameters for the campaign. The pitch went ahead as planned and we won the account.”,Behavioral,Good
Marketing Manager,Describe a product or service that you've marketed in the past.,"I previously worked for a company that provided an online documentation platform for customers and businesses. To use the platform to its fullest capacity, a customer or business had to sign up for a monthly subscription. I implemented a variety of marketing strategies and campaigns to ensure that our clientele was engaged enough to sign up for the trial and then become a full paying customer. The marketing campaigns did in fact boost our sales by 20% over the next several months.",Technical,Good
Marketing Manager,Describe a social media crisis you experienced and how you handled it.,"In my previous role, a situation occurred when Twitter's servers were down shortly before we planned to launch a social media campaign. While waiting for the issue to be resolved, we turned to our Instagram page instead. I had our graphics designer create a poster that directed users to check the Twitter account once they resolved the technical issue.",Technical,Good
Sales Manager,Describe a time that you dealt with a teammember who felt disciminated against.,"The first step is listen the team member about the concern, explain the why certain documentation are required (example: laws, policies and procedures, etc), document the conversation, and refer to Human Resources Department as the situation requires. ",Behavioral,Good
Sales Manager,Describe a time that you dealt with a teammember who felt disciminated against.,I addressed my team member's issue face to face and educated her as to why I was requesting certain information be documented.,Behavioral,Average
Sales Manager,Describe a time when you had to handle a difficult client or negotiation. How did you manage the situation?,"In a previous role, I encountered a client who was dissatisfied due to delivery delays. I initiated immediate contact, expressing empathy and understanding for their concerns. I took responsibility for the delays and outlined a detailed plan to rectify the situation, ensuring clear communication throughout. I offered compensation and incentives to regain their trust. By consistently updating them on progress and ensuring a smoother process for future deliveries, we not only retained the client but also received positive testimonials highlighting our commitment to customer satisfaction.",Behavioral,Good
Sales Manager,Describe a time when you had to handle a difficult client or negotiation. How did you manage the situation?,"I once had a client who was unhappy with our service. I spoke to them, apologized for the inconvenience, and offered some discounts on their next purchase. After that, they seemed okay.",Behavioral,Average
Sales Manager,Describe a time when you had to handle a difficult client or negotiation. How did you manage the situation?,"I had a difficult client, but I couldn't do much about it. It was a tough situation.",Behavioral,Poor
Sales Manager,Describe a time you got angry at work.,"I don't typically experience anger at work, but there have been times when I've felt disappointed and frustrated, which I think is normal. For instance, I felt really let down by one of my coworker's lack of communication last December. The holidays are always a really high demand time for everybody, and especially for those of us who work in sales. Unfortunately, my coworker decided at the last minute that she was going to take the two weeks leading up to Christmas off from work. This would've been fine if I knew ahead of time, but she didn't notify me until the day prior, so I couldn't come up with a plan. Overall, her absence made a stressful period even more so for me. I tried my best to meet expectations while she was out, and after the holidays, I spoke with her and directly asked her to make sure she communicates more effectively about her time off so we can avoid similar situations in the future. Thankfully, she was very apologetic and now considers how her absences impact our collective workflow.",Behavioral,Good
Marketing Manager,Describe a time you got angry at work.,"I try not to allow myself to get angry at work. Instead, I focus on communicating effectively with other parties and generating solutions that allow me to overcome obstacles successfully. For instance, I recently worked on a research project with a large scope alongside five other contributors. This project necessitated a high level of collaboration and cooperation between me and my teammates. Unfortunately, one of the other contributors seemed to struggle with working as a part of a team and regularly communicated using hostile language. Her resistance to our work started to impact the progress we made toward the project's goals. I decided to invite her to have coffee with me privately and discuss ways to optimize our joint approach. She admitted to me that she prefers to work independently, so I proposed that we break our project into smaller parts so she could make individual contributions instead of shared ones. After having this conversation, our relationship improved significantly, and we've become regular collaborators over the last year.",Behavioral,Good
Marketing Manager,Describe how do you handle conflict with coworkers.,"At my previous company, I started working as a content writer just a few weeks after a different content writer, and we quickly became friends. We had similar roles and responsibilities within the company, and we appeared to have similar trajectories with the company. However, I earned a promotion to become a lead writer, causing them to be upset and treat me differently. I asked them to meet with me one on one to discuss my promotion. They said they felt frustrated because they started before me and assumed they would be next to move into a lead writing position. I asked if they wanted my advice about how to earn the promotion in the future, and I shared some tips after they agreed. They thanked me for my feedback and used my feedback to improve their performance, and I recommended them to our manager for a promotion as soon as possible.",Behavioral,Good
Marketing Manager,Describe how do you handle conflict with coworkers.,"We had a new client working with our agency, and my manager asked both me and my coworker to prepare pitches for how to approach their marketing campaign with us. We pitched very different concepts, and the client liked certain aspects of both of our campaigns and asked us to work together. My coworker and I felt frustrated with each other because both believed our strategy was the better option to pursue. However, I suggested we work backward through our projects together. We explained our initial ideas to each other, what research we performed and how we chose tactics for the campaign. This helped us find commonalities between our pitches and how to incorporate them to complement one another. As a result, we delivered a campaign that the client loved so much that they set up an auto-renewal contract with us for several more years.",Behavioral,Good
Sales Manager,Describe how do you handle conflict with coworkers.,"In my most recent position as a client support specialist, my coworker and I were responsible for contacting all of our clients to request updated website login information from them to ensure we had accurate information on record. However, we miscommunicated about how to divide up the client list. I thought I would contact clients with names A through M and she would contact clients with names N through Z, and she thought the opposite. As a result, we contacted the same clients, which caused some confusion and clients for our clients. My coworker and I expressed our frustrations with each other, and we both acknowledged that we misheard each other. I suggested implementing a color-coding system to use on a shared spreadsheet for future projects like this one. This new system works well for us, and we haven't had any similar issues since this incident.",Behavioral,Good
Sales Manager,Describe how do you handle conflict with coworkers.,"When conflicts arise, I usually just avoid my coworkers who are involved. I don't like confrontation, so I keep to myself and hope the problem goes away on its own.",Behavioral,Poor
Sales Manager,Describe how do you improve employee morale and motivate your workers to do the best possible job.,"I like to make fun little competitions for things such as biggest sales and most shifts worked. Then, I offer fun prizes to the exemplary employees.",Behavioral,Good
Marketing Manager,Describe how you would manage customer complaints on your employer’s social media profile.,"I responded to the complaints by asking questions about the customer’s experience and then offered assistance to remedy the situation. I evaluated each situation, devised strategies to help the clients on a more personalized basis and increased consumer retention.",Behavioral,Good
Sales Manager,Describe the sales process at your previous company. What worked well? What didn’t work well?,"The previous company had a well-defined sales funnel, but the lead qualification process was inefficient. I suggested changes, which were implemented and led to a 15% increase in sales.",Technical,Good
Marketing Manager,Describe what user engagement means to you.,"Engagement means connecting with the target audience of a brand by actively listening and responding to their comments. From my experience, people like when brands make videos and use other creative strategies to connect with followers. I am confident I can reach more followers and develop exciting user engagement strategies for your brand.",Technical,Average
Sales Manager,Describe your approach to building and leading a successful sales team.,"In my previous role, I strongly believed in fostering a culture of empowerment and accountability within my sales team. I focused on hiring diverse talents and creating a collaborative environment where each team member felt valued. I encouraged open communication, ensuring that everyone's opinions were heard. Additionally, I provided continuous training and mentorship, tailoring development plans to individual strengths and weaknesses. By setting clear goals and metrics, tracking progress, and celebrating achievements, I fostered a motivated team that consistently surpassed targets.",Technical,Good
Sales Manager,Describe your approach to building and leading a successful sales team.,I believe in creating a positive work environment where everyone feels motivated. I hire talented individuals and provide necessary training. I set goals and track progress to ensure the team meets targets.,Technical,Average
Sales Manager,Describe your approach to building and leading a successful sales team.,"I just try to hire good people and hope for the best. I set targets, and the team has to meet them.",Technical,Poor
Sales Manager,Describe your customers’ buying decision process. Who approves or blocks the buying decision? What do you need to line up to close the sale?,"Usually, the IT manager initiates the buying process, but the CFO approves the budget. To close the sale, we need to provide a product demo, a cost-benefit analysis, and customer testimonials.",Technical,Good
Sales Manager,Describe your ideal company culture.,"I thrive in a work environment that values career development. Working in marketing, it can sometimes feel like our whole discipline can change overnight. Working on a team that not only values, but also sets aside resources for education and learning is incredibly important to me. At my last role, each employee was given a certain amount of work hours every quarter that were to be used for continued learning. That time allowed me to earn a few of the certifications listed on my resume.",Introductory,Good
Sales Manager,"Describe your previous company's culture. As a sales manager, how did you encourage your team to get involved?",The culture was a fun-loving group that marketed eco-friendly products and solutions. I hosted team events in support of sustainability to generate leads and support.,Technical,Good
Sales Manager,Describe your product. What are the benefits? Who are your customers?,"Our product is a cloud-based CRM software designed for small to medium-sized businesses. The benefits include better customer relationship management, streamlined sales processes, and data analytics. Our primary customers are SMEs in the tech industry.",Technical,Average
Sales Manager,Describe yourself with 3 words.,Leader among leaders,Introductory,Average
Sales Manager,Describe yourself with 3 words.,Sorry I can’t,Introductory,Poor
Sales Manager,Do you consider yourself a big-picture person or a detail- oriented person?,"If I had to choose, I would say that I lean more towards being big-picture oriented. I don’t mind getting in the weeds on a project, but I’m always careful not to spend too much time there. I appreciate the small, day-to- day details but ultimately they are all meant to add together to form the big picture.",Behavioral,Average
Marketing Manager,Do you have any experience managing a marketing team?,"Yes. In my previous job, I was responsible for managing a marketing team. My main responsibilities included training new employees, delegating and supporting the team. I also reported to the head of the company's sales and marketing department.",Technical,Average
Sales Manager,Do you have any questions for me?,What opportunities will I have to learn and grow in my career?,Conclusion,Good
Sales Manager,Do you have any questions for me?,What is the typical career path for someone hired into this role?,Conclusion,Good
Sales Manager,Do you have any questions for me?,Do you have any concerns about my skills or work history that I could have the opportunity to address?,Conclusion,Good
Sales Manager,Do you have any questions for me?,What would you want to see me accomplish in the first 90 days?,Conclusion,Good
Sales Manager,Do you have any questions for me?,"No, I don't have any questions. I think you've covered everything.",Conclusion,Poor
Marketing Manager,Do you have any questions for me?,"No, I don't have any questions. I think you've covered everything.",Conclusion,Poor
Marketing Manager,Do you have experience or a background in marketing?,I worked as a digital marketing coordinator for a few years with an online apparel and clothing company. So I was one of the primary people who coordinated marketing efforts on social media accounts and on their website. I also coordinated a marketing campaign where we partnered with various online platforms to achieve greater outreach.,Introductory,Average
Marketing Manager,Do you have experience or certifications in working with CRM software to prioritize leads and develop marketing campaigns?,"I used Salesforce for customer-centric campaigns. I assigned leads from the website, chats, trade shows and social media and triggered alerts in special cases.",Technical,Good
Sales Manager,Do you prefer working with a team or working independently?,"I feel that both have their time and place in a productive work environment and I truly value each one. When it’s time to brainstorm or strategize, I prefer working in a group, but feel that independent work suits me better when it comes to deep work. I tend to be a very adaptable person, which I attribute to the first company I worked at. It was a team of about a dozen people and we all worked together in a big room, sharing two tables. Working there taught me how to be able to pivot between independent and collaborative work on a dime.",Introductory,Good
Sales Manager,Do you work well with others?,"In my previous job as a shift manager, I was the leader for a night shift at a 24-hour retail store. I had a small team and we all knew each other very well and I focused heavily on communication, honesty and team support. One night, an employee's father passed away suddenly and another employee became frustrated because they had to cover the shift even though they had a newborn at home. I offered to cover the shift myself to avoid conflict and set an example of compassion for my team. I think these values are crucial to teamwork.",Introductory,Good
