Position/Role,Question,Answer,Interview Phase,Answer Quality
Sales Manager,How would you describe yourself in 3 words?,"I'd describe myself as driven, communicative and reliable. I consider myself to be driven because I'm always working toward a new goal and refuse to give up if met with any obstacles. I chose communicative because I greatly enjoy collaborative work and would love the opportunity to learn from others if given this position. Finally, I picked reliable because I stick to my commitments. If I volunteer to do something, you can guarantee I'll get it done to the best of my abilities.",Introductory,Good
Sales Manager,How would you describe yourself in 3 words?,"I'm friendly, outgoing, and funny.",Introductory,Poor
Marketing Manager,How would you describe yourself in 3 words?,"First, I am passionate. I have always been interested in science and like to learn as much as possible about new topics. Second, I am empathetic. I always try to understand others' perspectives and find ways to relate to them. Finally, I am inquisitive. I like to explore the world around me and find meaningful ways to contribute to conversations.",Introductory,Good
Sales Manager,How would you describe yourself in 3 words?,"The first word I would use to describe myself is approachable. I pride myself on the fact that I always put in extra effort to make a customer feel comfortable when trying to assist them. I am also quite observant. I try to pick up on small details that others may not have noticed. Lastly, I am open-minded. I enjoy trying new approaches and techniques to customer service.",Introductory,Good
Marketing Manager,How would you describe yourself in 3 words?,"Enthusiastic, confident and friendly are three words I'd pick to describe myself. My enthusiasm for health care allows me to stay motivated at work and find importance in what I'm doing. My confidence helps me recognize my abilities while also knowing that there's always room to learn more. I also think of myself as an incredibly friendly person, as I enjoy interacting with my patients and colleagues every day.",Introductory,Good
Marketing Manager,How would you describe yourself in 3 words?,"I am organized, patient and helpful. I pride myself on my time management skills and ability to meet multiple deadlines. When I have writer's block, I do not give up. Instead, I maintain my patience and keep working on the piece until I think of a great idea. I also enjoy helping my team members approach their projects with different methods. I often find happiness in assisting others.",Introductory,Good
Sales Manager,How would you describe yourself?,"I am definitely a people person. I love being able to meet new people and form positive relationships with those I work with. That is one of many reasons that I love working in marketing. Forming and nurturing client relationships makes me excited, especially when I get to do that on behalf of a company like yours that is providing real solutions to real problems",Introductory,Good
Marketing Manager,How would you devise an on-the-spot marketing strategy for a new customer?,"Since the product is aimed at commuters who do not have a vehicle, I would advertise promotions inside buses, taxis and subways and their respective shelters.",Technical,Good
Marketing Manager,How would you explain the importance of digital marketing to more old-fashioned clients who are not familiar with the concept?,"Using digital marketing can help business owners reach bigger audiences globally while keeping costs smaller than with traditional advertising. Other than being cost-effective, modern marketing tactics are also easy to measure, which allows companies to see if expanding to new markets is profitable before making big decisions.",Technical,Good
Sales Manager,How would you handle a personality conflict with a client or colleague?,"If a personality conflict interfered with my work, I’d seek counsel on how I could better understand my client’s point of view.",Behavioral,Average
Sales Manager,How would you handle a situation in which an angry customer was mad at an employee?,"After calming down the customer with an apology and discounts, I'd learn more about the incident from other witnesses and discipline the employee if needed.",Behavioral,Good
Sales Manager,How would you handle having to fire someone?,"I have fortunately never been in the position of having to end someone’s employment, but if I were to ever be in that position I would try to handle every aspect with kindness. I hope that before reaching a point of having to let someone go, any other measures would have already been exhausted, such as offering additional training or implementing a performance improvement plan. Maintaining clear lines of communication surrounding performance and expectations is crucial, in addition to providing reasonable support as necessary.",Behavioral,Good
Marketing Manager,How would you handle negative feedback about your company on social media?,"If I could reach out to the person privately, I would because I would want to see if there’s any way to turn their experience of us around.",Behavioral,Good
Sales Manager,"How would you manage critical recognition for top salespeople, support staff and most improved sales performances?","I tried to recognize improved performances, top sellers and support staff for their contributions. I set team and personal goals and checked on progress daily.",Technical,Good
Marketing Manager,How would you market a new product targeted toward young adults?,"The way I would market the new product may vary slightly depending on the product. However, I would absolutely capitalise on using social media platforms to target young adults because they have a very prominent presence on social media and mobile social applications. Targeting them through these two mediums with trendy language and tools that young adults enjoy would be my first marketing strategy.",Technical,Good
Marketing Manager,How would you persuade an organization to get on board with your ambitious marketing campaign idea?,I typically submit an email containing what I call an employee action plan. This is a blueprint that illustrates each individual's role and responsibility toward achieving the company's targets through the project that I'm pitching. It helps motivate the organization and gets everyone to buy in.,Technical,Good
Marketing Manager,"If a campaign failed, what metrics would you analyze to avoid a similar pitfall for future marketing projects?","Typically, the first step is to identify if the campaign targeted the right audience. Secondly, I usually double-check the research and metrics that were used. Finally, I would try to get consumer feedback to make sure that our product is meeting their expectations.",Technical,Good
Marketing Manager,"If you could change something about social media, what would it be?","If I could change something about social media, it would be the amount of bots that follow and unfollow accounts. I hope that in the future these platforms can reduce the number of fake accounts and make it easier to engage with a target audience who really cares about the brand.",Technical,Good
Sales Manager,"If you were your own client, how would you describe yourself as an sales manager?",I’m capable and friendly. I’m also proactive to present new ideas. I’m a pleasant person overall as well as a good listener. I’m understanding of client needs.,Introductory,Good
Sales Manager,"In six months, how would you know you are successful?","I think it’s important to look at how my team is doing both as a whole and on an individual level. I would measure success by seeing if all my reps are performing consistently month over month, quarter over quarter, and year over year. I also think success goes beyond the numbers. The more qualitative piece comes such as how engaged my reps are and how I am working to motivate them are equally important. I would analyze the success of our onboarding, ongoing training and potentially compensation too.",Behavioral,Average
Marketing Manager,"In your opinion, how essential is it for content managers to understand the fundamentals of digital marketing?","An understanding of the fundamentals of digital marketing is crucial for content managers. Because every piece of content that we write or commission is meant to further our firm's marketing interests. So I need to understand its exact purpose and desired outcome. Perhaps we want it to propel our firm forward as an industry leader, attract our target customers or provide necessary information to existing customers. We will need to plan the content according to the purpose and devise different ways to market it on separate platforms on the internet. For example, we could take one piece of content and convert it into a slide presentation, video, audio, blog and article.",Technical,Good
Sales Manager,"In your previous position as a retail store manager, did you have an underperforming employee? How did you handle the situation?","In my previous position, I had to approach an underperforming employee. I gave them a plan. Within a couple of weeks, their performance improved.",Behavioral,Good
Sales Manager,"Provide an example of a time you disappointed a client or colleague. As a sales manager, how did you resolve the problem?","Once, I misunderstood a client’s needs and lost the account. I learned that clear communication is vital to success. Now, it’s my top priority.",Behavioral,Average
Sales Manager,Recall a time when you mentored a colleague. Where did they start? Where are they now?,"I mentored a junior sales rep who started with a low sales record. After six months of coaching, he became one of the top performers in the team.",Behavioral,Average
Sales Manager,Recall a time you resolved a conflict between two team members.,"Two team members had a disagreement over client ownership. I facilitated a meeting to clarify roles and responsibilities, which resolved the issue.",Behavioral,Average
Sales Manager,"Sales managers have to juggle many responsibilities. On any given day, what does your workspace look like concerning organization?",I keep a neat desk with only one project open at a time. Everything else gets filed so that I can find it quickly.,Introductory,Average
Sales Manager,Sell me this lock.,Now am a salesman and also worked as a sales manager I know how to communicate with different type characters of people and am confident to eligible for this job,Technical,Poor
Sales Manager,Sell me this lock.,Hello sir. This lock is very good. Its price is lower than other locks. This lock is made with good material. Cutter and hammer not break it. So i advise u buy this lock.,Technical,Average
Sales Manager,Sell me this pen.,"Ask what they see in a pen. If he remembers the last pen he used, and what price he would put on a pen he uses for signing big important contracts. As soon as he names a price... sold ",Technical,Average
Sales Manager,Sell me this pen.,"This pen has an option for lifetime ink cartridges. So if you buy the bundle with lifetime cartridges you will never need another pen again. If you buy 50 pens, the 1st pen is at no charge. These would be great for advertising purposes. We can engrave each pen with your company information on it. This promotion ends this week. How many would you like?",Technical,Good
Sales Manager,Sell me this pen.,"This pen is not just any pen; it's a versatile tool that can help you stay organized and efficient in your daily life. Imagine yourself in a meeting or at an important conference, and you need to jot down a crucial idea or contact information quickly. This pen's ergonomic design ensures a comfortable grip, and its smooth ink flow guarantees that your notes are clear and legible. Plus, it comes with a handy pocket clip, so you'll always have it at your fingertips when you need it. Investing in this pen means you're investing in convenience, professionalism, and the assurance that you won't miss a single detail in your important moments.",Technical,Good
Sales Manager,Sell me this pen.,"He wanted a better price, so I told him that if he bought 5 he'd get a better price. I got the job. ",Technical,Average
Sales Manager,Sell me this pen.,Ask them to write their name. Create a need for the product you have.,Technical,Average
Sales Manager,Sell me this pen.,I held the pen. I smiled and greeted my interviewer. I proceeded to introduce myself. I complimented his tie. Then I asked him what brought him in today. Then I asked him if he had seen the latest model of the this particular pen. I gave him each feature with how it would benefit him. Then I asked him if he would like to try it out. After he wrote with it. I asked him if he had any particular colors in mind. Then I asked him how many he'd want.,Technical,Good
Sales Manager,Sell me this lock.,Now am a salesman and also worked as a sales manager I know how to communicate with different type characters of people and am confident to eligible for this job,Technical,Poor
Marketing Manager,Tell me about a campaign that didn’t go as expected and what you did as a result.,"One unique but somewhat risky communications campaign resulted in a very low response rate during the first month. As I was monitoring and reviewing the data regularly, we were able to make the necessary changes in a timely manner and improve results.",Technical,Good
Sales Manager,Tell me about a challenging sales call you had. How did you handle it?,"One of my most difficult calls was when I was following up with a potential lead. They didn’t seem to understand the product, and I could tell they were getting frustrated. I decided to pause for a moment and ask them if I could walk them through a step by step of what our product could do for them. I think pausing and backing up helped me get a better grasp on the call, and although the lead didn’t end up going anywhere, I got a chance to explain our product with more intention.",Technical,Good
Sales Manager,"Tell me about a challenging sales situation you faced. How did you approach it, and what was the outcome?","In my previous role, we faced a challenging situation where a major client was considering moving to a competitor due to service issues. I proactively reached out to the client to understand their concerns in detail. I assembled a team meeting where we created a personalized action plan addressing each issue. I also ensured direct involvement, regularly checking in with the client to ensure their satisfaction. This approach not only retained the client but also led to them increasing their contract by 30% within six months.",Technical,Good
Sales Manager,"Tell me about a challenging sales situation you faced. How did you approach it, and what was the outcome?","Once, we had a client unhappy with our product's performance. I talked to the team and worked on fixing the issues. After a few weeks, we resolved the problems, and the client seemed satisfied.",Technical,Average
Sales Manager,"Tell me about a challenging sales situation you faced. How did you approach it, and what was the outcome?","I faced a difficult situation when a client was unhappy. I tried to fix it, but it was tough.",Technical,Poor
Sales Manager,Tell me about a time when you did not meet your quota.  How did you handle it?,"There was one quarter when business was slow and I didn’t meet goals. My first step was to let my manager know what was going on and see if there was anything that could be done to improve my outcomes. Although I still wasn’t able to meet quota that quarter, being able to ask for help and  work closely with my manager to assess my sales tactics and create an action plan taught me so much and helped me meet my quota the following quarter. That is the kind of support I would strive to offer sales reps as a sales manager.",Behavioral,Good
Sales Manager,Tell me about a time when you had to adapt to major change in the workplace. How did you cope?,"I was about four months into my last role working as an affiliate program manager when my manager came to me and asked me to also take over our Amazon advertising campaigns. I had never worked with Amazon ads before and had limited experience in paid search. I had the time to take over this responsibility and am always eager to help my team, but this added responsibility did require a lot of self-educating. The benchmark from my manager was to keep our ROAS between 4 and 5, which I was able to successfully accomplish. I had to ask a lot of questions and spend a good amount of time researching and self-teaching, but I’m thankful for the opportunity to have expanded my skills.""",Behavioral,Good
Sales Manager,Tell me about a time when you had to deal with conflict on the job.,"I once worked somewhere that would do project reviews with the whole design team. We would do a round robin of sharing our screens and critiquing each other’s work. Normally, these were fine and I did learn a lot from my team members. But there was a certain person on my team at the time who was very difficult to work with, especially during these reviews. I found that her feedback would often be very harsh, not only to me but to other teammates as well. After a session where she had been particularly difficult to work with, I decided to speak with her privately afterwards. I explained that I valued her experience and perspective, but wanted to communicate how she was coming across. The conversation was really productive and I think we were able to understand each other better. In future reviews, I really noticed an effort from her to speak with more kindness towards our team.",Behavioral,Good
Sales Manager,Tell me about a time when you had to give someone difficult feedback.,"Delivering effective feedback requires a balance of empathy and tact. Hiring managers want to understand your ability to navigate delicate situations, foster productive relationships, and deliver honest feedback even when it isn’t always easy to do so. Form a specific and constructive answer by leaning into the steps you took to address the situation.",Behavioral,Good
Sales Manager,Tell me about a time when you had to give someone difficult feedback.,"Delivering effective feedback requires a balance of empathy and tact. Hiring managers want to understand your ability to navigate delicate situations, foster productive relationships, and deliver honest feedback even when it isn’t always easy to do so. Form a specific and constructive answer by leaning into the steps you took to address the situation.",Behavioral,Good
Sales Manager,Tell me about a time when you had to make a decision but you didn't have all the information to hand.,"I was once responsible for determining a budget for an ecommerce project that had a lot of variables. It was a unique circumstance and would involve our team using this specific retail media network for the first time. We didn’t have historical data to help us forecast expenses and, ultimately, there were just a lot of unknowns. Because we couldn’t start the project until a budget was determined, I used my best judgment to determine our spend allowance. Unfortunately, I underestimated and we did have to request a budget extension from management. Even though I didn’t make the right choice, it was a great learning opportunity and helped improve my accuracy in budget estimation in the future.",Behavioral,Good
Sales Manager,Tell me about a time when you missed a deadline.,"I missed a deadline once, but it wasn't really my fault. The client kept changing their requirements, and our team wasn't communicating well. It was a mess, and we just couldn't meet the deadline. It was frustrating, but there was nothing I could do about it.",Behavioral,Poor
Sales Manager,Tell me about a time when you missed a deadline.,"In my current position as a manager, I trained 43 new employees in our supply chain operations. During the time I had reserved for this training, an incident occurred in the warehouse that required my assistance. As a result, I delayed the training by a week. As soon as I delayed the training, I contacted the corporate office, and they approved the new training period, agreeing to implement an extra week for training new employees if a similar situation arose again in the future. I also met with the other assistant managers in the company and developed a contingency plan that ensured employees underwent training as soon as possible if someone had free time in their work schedule to train employees for that week. I learned the importance of having a contingency plan to prevent lost time and ensure that I can adhere to the deadline for training new employees.",Behavioral,Good
Sales Manager,Tell me about a time where you had to deal with a difficult customer. How did you handle it and what steps did you take?,"There are no difficult customers in my view I’d make them happy satisfied immediately in my charisma character, firm is family",Behavioral,Poor
Marketing Manager,Tell me about a time you made a mistake.,"In a previous role, I was responsible for deploying marketing emails using our ESP. I once had built and scheduled an email that was scheduled to send to about 100,000 users. About an hour after the email was sent, I realized I hadn’t updated the subject line and it was just the campaign name and send date. I was so embarrassed! And email is such a tough channel to make a mistake on, because there really is no way to correct it. Fortunately, my manager was very understanding of the error and so was our audience. In response to my mistake, I created a more comprehensive review process that helped ensure we didn’t miss things like that in the future.",Behavioral,Good
Marketing Manager,Tell me about a time you made a mistake.,"I can't really think of any major mistakes I've made in my career. I'm usually very careful and detail-oriented, so I tend to avoid making mistakes. I believe in doing things right the first time.",Behavioral,Poor
Sales Manager,Tell me about a time you successfully upsold a current client and how you achieved the sale.,"At my last sales position in software sales, I saw the opportunity to introduce a longtime customer to one of our new executive-level programs. I asked them what they found most useful about our current software and was able to tactfully bring up how our upgraded software package could perform those tasks more efficiently and improve overall organization. Showing them a demo and informing them about the product in a low-pressure, conversational environment allowed me to easily secure the sale.",Technical,Good
Marketing Manager,"Tell me about a time you were in a conflict with a colleague, and how did you resolve the situation?","There was a time when a colleague and I were in a firm disagreement about a marketing strategy we were going to implement for one of our products. To resolve the issue, I proposed that we establish the pros and cons of each marketing strategy and then implement the aspects of both to create a new strategy. This actually proved successful, as we saw exceptionally positive results from our combined marketing campaign.",Behavioral,Good
Marketing Manager,Tell me about the biggest marketing challenge you've had to overcome.,"My biggest challenge was when I had to coordinate the implementation of two marketing campaigns simultaneously. This was at a time when the company I worked for was seeing rapid growth, and we didn't have the staff to keep up, so I had to take on a lot of extra responsibility. I coordinated with my team members to work additional hours every day for a few months to ensure the marketing campaigns were successful. I think my drive to see the work get done no matter what is something that has universal applications.",Behavioral,Good
Sales Manager,Tell me about your greatest success with sales. How did you achieve that?,"There was a big client the company wanted to land a deal with, but the client had hesitations about the product. I made a list of solutions that our product offers and identified how the product could help this particular client. Then I was persistent but thoughtful with my follow up communication, and we eventually discussed specific options. This resulted in a closed deal.” ",Technical,Good
Sales Manager,Tell me about your work history.,"I started my marketing career right out of college when I started working as an account manager at a small agency. That job gave me the opportunity to start working in SEO and learning from the strategists I worked with. I left that agency after 2 years after being offered the opportunity to work as an SEO strategist for a national skincare company. After eight months there, I was promoted to manage the brand's blog and was eventually tasked with overseeing both our blog and affiliate marketing programs. I feel that this experience specifically prepared me for the role you’re looking to fill because it trained me to make strategically-sound decisions that balanced the priorities of multiple marketing programs.",Introductory,Good
Sales Manager,Tell me about yourself.,"I’ve been working in digital marketing for three years. At my current role, I oversee campaign analysis for several clients and focus on ROAS (Return on Ad Spend) optimization. Over the course of my career, I’ve had the opportunity to work on campaigns for clients in all kinds of industries, from cosmetics brands to software companies. I’m known by colleagues for being detail-oriented and a team player. I love using data to help inform creative strategy, which is why I was particularly interested in this digital marketing role at your company.",Introductory,Good
